-- roaring_index_count(): heap-skipping count(*) (DESIGN.md section 9).
--
-- Every assertion here is "the function agrees with the equivalent SELECT
-- under the same snapshot".  The counting must therefore never be allowed to
-- answer the reference query as well, so the phase-2b pushdown is switched
-- off for this file.  LOAD makes the GUC exist before we set it: the library
-- is otherwise only loaded when the planner first opens a roaring index.
\set VERBOSITY terse
SET client_min_messages = warning;
LOAD 'roaring_index';
SET roaring_index.enable_count_pushdown = off;
/*
 * The visibility map is what makes this feature worth having, and a heap page
 * only becomes all-visible once the inserting transaction's commit record has
 * reached disk.  The dev cluster runs with synchronous_commit = off, so ask
 * for flushed commits here; otherwise whether VACUUM can set the bits depends
 * on how fast the WAL writer happens to be.
 */
SET synchronous_commit = on;
CREATE EXTENSION IF NOT EXISTS roaring_index;
/*
 * rbi_ccmp() compares roaring_index_count() against count(*) for one key.
 * 'val' is a SQL expression, so cross-type calls can be written out in full.
 */
CREATE OR REPLACE FUNCTION rbi_ccmp(idx text, tbl text, col text, val text)
RETURNS text LANGUAGE plpgsql AS $$
DECLARE
	a bigint;
	b bigint;
BEGIN
	EXECUTE format('SELECT roaring_index_count(%L::regclass, %s)', idx, val) INTO a;
	EXECUTE format('SELECT count(*) FROM %s WHERE %I = %s', tbl, col, val) INTO b;
	IF a IS DISTINCT FROM b THEN
		RETURN format('MISMATCH roaring=%s select=%s', a, b);
	END IF;
	RETURN format('ok %s', a);
END $$;
CREATE OR REPLACE FUNCTION rbi_ccmp2(idx1 text, val1 text, idx2 text, val2 text,
									 tbl text, col1 text, col2 text)
RETURNS text LANGUAGE plpgsql AS $$
DECLARE
	a bigint;
	b bigint;
BEGIN
	EXECUTE format('SELECT roaring_index_count(%L::regclass, %s, %L::regclass, %s)',
				   idx1, val1, idx2, val2) INTO a;
	EXECUTE format('SELECT count(*) FROM %s WHERE %I = %s AND %I = %s',
				   tbl, col1, val1, col2, val2) INTO b;
	IF a IS DISTINCT FROM b THEN
		RETURN format('MISMATCH roaring=%s select=%s', a, b);
	END IF;
	RETURN format('ok %s', a);
END $$;
/*
 * 200k rows over ~1100 heap pages, i.e. about 18 containers per full-table
 * posting set.  c10 (20000 rows per key) spills to a chain of container
 * pages; c5000 (40 rows per key) stays inline in its entry tuple; both paths
 * of rbi_count.c are therefore exercised by the queries below.
 */
CREATE TABLE rbi_cnt AS
SELECT i,
       (i % 10)::int4                                   AS c10,
       ((i::bigint * 7919) % 5000)::int4                AS c5000,
       ((i::bigint * 104729) % 100000)::int8            AS c100k,
       ('key ' || ((i::bigint * 31) % 1000))::text      AS t1000,
       (i % 7)::int4                                    AS m7,
       (i % 3 = 0)                                      AS b3
  FROM generate_series(1, 200000) i;
CREATE INDEX rbi_cnt_c10 ON rbi_cnt USING roaring (c10);
CREATE INDEX rbi_cnt_c5000 ON rbi_cnt USING roaring (c5000);
CREATE INDEX rbi_cnt_c100k ON rbi_cnt USING roaring (c100k);
CREATE INDEX rbi_cnt_t1000 ON rbi_cnt USING roaring (t1000);
CREATE INDEX rbi_cnt_m7 ON rbi_cnt USING roaring (m7);
CREATE INDEX rbi_cnt_b3 ON rbi_cnt USING roaring (b3);
ANALYZE rbi_cnt;
-- chain entries (20000 TIDs per key)
SELECT rbi_ccmp('rbi_cnt_c10', 'rbi_cnt', 'c10', '0');
 rbi_ccmp 
----------
 ok 20000
(1 row)

SELECT rbi_ccmp('rbi_cnt_c10', 'rbi_cnt', 'c10', '7');
 rbi_ccmp 
----------
 ok 20000
(1 row)

SELECT rbi_ccmp('rbi_cnt_c10', 'rbi_cnt', 'c10', '9');
 rbi_ccmp 
----------
 ok 20000
(1 row)

-- the widest posting sets of all: two thirds / one third of the table
SELECT rbi_ccmp('rbi_cnt_b3', 'rbi_cnt', 'b3', 'true');
 rbi_ccmp 
----------
 ok 66666
(1 row)

SELECT rbi_ccmp('rbi_cnt_b3', 'rbi_cnt', 'b3', 'false');
 rbi_ccmp  
-----------
 ok 133334
(1 row)

-- inline entries (40 TIDs per key)
SELECT rbi_ccmp('rbi_cnt_c5000', 'rbi_cnt', 'c5000', '0');
 rbi_ccmp 
----------
 ok 40
(1 row)

SELECT rbi_ccmp('rbi_cnt_c5000', 'rbi_cnt', 'c5000', '1234');
 rbi_ccmp 
----------
 ok 40
(1 row)

SELECT rbi_ccmp('rbi_cnt_c5000', 'rbi_cnt', 'c5000', '4999');
 rbi_ccmp 
----------
 ok 40
(1 row)

/*
 * Two TIDs per key: c100k's posting sets are sparse segments, not containers
 * (DESIGN.md section 13), so the set cursor has to present each of their
 * container keys as a temporary container of its own.
 */
SELECT containers, sparse_segments > 0 AS has_segments,
	   sparse_members = ntids AS every_tid_in_a_segment
  FROM roaring_index_stats('rbi_cnt_c100k');
 containers | has_segments | every_tid_in_a_segment 
------------+--------------+------------------------
          0 | t            | t
(1 row)

SELECT rbi_ccmp('rbi_cnt_c100k', 'rbi_cnt', 'c100k', '29');
 rbi_ccmp 
----------
 ok 2
(1 row)

SELECT rbi_ccmp('rbi_cnt_c100k', 'rbi_cnt', 'c100k', '99729');
 rbi_ccmp 
----------
 ok 2
(1 row)

-- by-reference keys
SELECT rbi_ccmp('rbi_cnt_t1000', 'rbi_cnt', 't1000', '''key 0''::text');
 rbi_ccmp 
----------
 ok 200
(1 row)

SELECT rbi_ccmp('rbi_cnt_t1000', 'rbi_cnt', 't1000', '''key 777''::text');
 rbi_ccmp 
----------
 ok 200
(1 row)

-- keys that match nothing at all
SELECT rbi_ccmp('rbi_cnt_c10', 'rbi_cnt', 'c10', '-1');
 rbi_ccmp 
----------
 ok 0
(1 row)

SELECT rbi_ccmp('rbi_cnt_c5000', 'rbi_cnt', 'c5000', '1000000');
 rbi_ccmp 
----------
 ok 0
(1 row)

SELECT rbi_ccmp('rbi_cnt_t1000', 'rbi_cnt', 't1000', '''no such key''::text');
 rbi_ccmp 
----------
 ok 0
(1 row)

-- cross-type keys resolved through the shared integer operator family
SELECT rbi_ccmp('rbi_cnt_c100k', 'rbi_cnt', 'c100k', '29::int4');
 rbi_ccmp 
----------
 ok 2
(1 row)

SELECT rbi_ccmp('rbi_cnt_c100k', 'rbi_cnt', 'c100k', '29::int2');
 rbi_ccmp 
----------
 ok 2
(1 row)

SELECT rbi_ccmp('rbi_cnt_c10', 'rbi_cnt', 'c10', '7::int8');
 rbi_ccmp 
----------
 ok 20000
(1 row)

SELECT rbi_ccmp('rbi_cnt_c10', 'rbi_cnt', 'c10', '7::int2');
 rbi_ccmp 
----------
 ok 20000
(1 row)

/*
 * Two keys at once: the merge of two posting sets.  Both keys share a single
 * anyelement in the function's signature, so they have to resolve to the same
 * SQL type; the index each one is looked up in may of course be on a
 * different (cross-type compatible) type, as the c100k case below shows.
 */
SELECT rbi_ccmp2('rbi_cnt_c10', '3', 'rbi_cnt_m7', '2',
				 'rbi_cnt', 'c10', 'm7');
 rbi_ccmp2 
-----------
 ok 2857
(1 row)

SELECT rbi_ccmp2('rbi_cnt_m7', '0', 'rbi_cnt_c10', '9',
				 'rbi_cnt', 'm7', 'c10');
 rbi_ccmp2 
-----------
 ok 2857
(1 row)

-- chain entry AND inline entry (every c5000 = 1234 row has c10 = 6)
SELECT rbi_ccmp2('rbi_cnt_c10', '6', 'rbi_cnt_c5000', '1234',
				 'rbi_cnt', 'c10', 'c5000');
 rbi_ccmp2 
-----------
 ok 40
(1 row)

SELECT rbi_ccmp2('rbi_cnt_c10', '3', 'rbi_cnt_c5000', '1234',
				 'rbi_cnt', 'c10', 'c5000');
 rbi_ccmp2 
-----------
 ok 0
(1 row)

-- an int8 index probed with an int4 constant, ANDed with an int4 index
SELECT rbi_ccmp2('rbi_cnt_c10', '1', 'rbi_cnt_c100k', '29',
				 'rbi_cnt', 'c10', 'c100k');
 rbi_ccmp2 
-----------
 ok 2
(1 row)

SELECT rbi_ccmp2('rbi_cnt_c10', '9', 'rbi_cnt_c100k', '29',
				 'rbi_cnt', 'c10', 'c100k');
 rbi_ccmp2 
-----------
 ok 0
(1 row)

-- an intersection that is empty although both keys exist
SELECT rbi_ccmp2('rbi_cnt_c10', '1', 'rbi_cnt_c5000', '0',
				 'rbi_cnt', 'c10', 'c5000');
 rbi_ccmp2 
-----------
 ok 0
(1 row)

-- one key that does not exist at all
SELECT rbi_ccmp2('rbi_cnt_c10', '1', 'rbi_cnt_c5000', '1000000',
				 'rbi_cnt', 'c10', 'c5000');
 rbi_ccmp2 
-----------
 ok 0
(1 row)

-- An empty table, and a table whose only key has one row.
CREATE TABLE rbi_cnt_tiny (k int4);
CREATE INDEX rbi_cnt_tiny_k ON rbi_cnt_tiny USING roaring (k);
SELECT rbi_ccmp('rbi_cnt_tiny_k', 'rbi_cnt_tiny', 'k', '1');
 rbi_ccmp 
----------
 ok 0
(1 row)

DROP INDEX rbi_cnt_tiny_k;
INSERT INTO rbi_cnt_tiny VALUES (1);
CREATE INDEX rbi_cnt_tiny_k ON rbi_cnt_tiny USING roaring (k);
SELECT rbi_ccmp('rbi_cnt_tiny_k', 'rbi_cnt_tiny', 'k', '1');
 rbi_ccmp 
----------
 ok 1
(1 row)

SELECT rbi_ccmp('rbi_cnt_tiny_k', 'rbi_cnt_tiny', 'k', '2');
 rbi_ccmp 
----------
 ok 0
(1 row)

/*
 * The visibility map interlock.  Nothing is all-visible before the first
 * VACUUM, so every TID has to be rechecked in the heap; afterwards the whole
 * posting set is answered from the map.
 */
SELECT count = 20000 AS count_ok, blocks_skipped = 0 AS nothing_skipped,
       tids_rechecked = 20000 AS all_rechecked
  FROM roaring_index_count_stats('rbi_cnt_c10', 0);
 count_ok | nothing_skipped | all_rechecked 
----------+-----------------+---------------
 t        | f               | f
(1 row)

VACUUM rbi_cnt;
SELECT count = 20000 AS count_ok, blocks_skipped > 0 AS skipped_some,
       tids_rechecked = 0 AS nothing_rechecked
  FROM roaring_index_count_stats('rbi_cnt_c10', 0);
 count_ok | skipped_some | nothing_rechecked 
----------+--------------+-------------------
 t        | t            | t
(1 row)

/*
 * After a DELETE the affected heap pages lose their all-visible bit, so those
 * blocks come back through the recheck path and the deleted rows are not
 * counted -- while the index still lists them, because VACUUM has not run.
 */
DELETE FROM rbi_cnt WHERE i % 4 = 0;
SELECT count = (SELECT count(*) FROM rbi_cnt WHERE c10 = 0) AS count_ok,
       tids_rechecked > 0 AS rechecked_some
  FROM roaring_index_count_stats('rbi_cnt_c10', 0);
 count_ok | rechecked_some 
----------+----------------
 t        | t
(1 row)

SELECT rbi_ccmp('rbi_cnt_c10', 'rbi_cnt', 'c10', '0');
 rbi_ccmp 
----------
 ok 10000
(1 row)

SELECT rbi_ccmp('rbi_cnt_c5000', 'rbi_cnt', 'c5000', '1234');
 rbi_ccmp 
----------
 ok 40
(1 row)

SELECT rbi_ccmp('rbi_cnt_t1000', 'rbi_cnt', 't1000', '''key 777''::text');
 rbi_ccmp 
----------
 ok 200
(1 row)

SELECT rbi_ccmp2('rbi_cnt_c10', '3', 'rbi_cnt_m7', '2',
				 'rbi_cnt', 'c10', 'm7');
 rbi_ccmp2 
-----------
 ok 2857
(1 row)

-- ... and after VACUUM the dead TIDs are gone and the map answers again.
VACUUM rbi_cnt;
SELECT count = (SELECT count(*) FROM rbi_cnt WHERE c10 = 0) AS count_ok,
       blocks_skipped > 0 AS skipped_some,
       tids_rechecked = 0 AS nothing_rechecked
  FROM roaring_index_count_stats('rbi_cnt_c10', 0);
 count_ok | skipped_some | nothing_rechecked 
----------+--------------+-------------------
 t        | t            | t
(1 row)

SELECT rbi_ccmp('rbi_cnt_c10', 'rbi_cnt', 'c10', '0');
 rbi_ccmp 
----------
 ok 10000
(1 row)

SELECT rbi_ccmp('rbi_cnt_b3', 'rbi_cnt', 'b3', 'true');
 rbi_ccmp 
----------
 ok 50000
(1 row)

SELECT rbi_ccmp('rbi_cnt_c5000', 'rbi_cnt', 'c5000', '1234');
 rbi_ccmp 
----------
 ok 40
(1 row)

/*
 * Snapshot behaviour.  A cross-session test needs isolationtester (see
 * test/isolation/count_snapshot.spec); what a single session can show is that
 * the count uses the *active* snapshot, so inside a REPEATABLE READ
 * transaction it tracks the transaction's own changes and forgets them again
 * when they are rolled back.
 */
BEGIN ISOLATION LEVEL REPEATABLE READ;
SELECT roaring_index_count('rbi_cnt_c10', 0) = (SELECT count(*) FROM rbi_cnt WHERE c10 = 0) AS agrees;
 agrees 
--------
 t
(1 row)

DELETE FROM rbi_cnt WHERE c10 = 0 AND i % 30 = 10;
SELECT roaring_index_count('rbi_cnt_c10', 0) = (SELECT count(*) FROM rbi_cnt WHERE c10 = 0) AS agrees_after_own_delete;
 agrees_after_own_delete 
-------------------------
 t
(1 row)

SAVEPOINT s;
DELETE FROM rbi_cnt WHERE c10 = 0 AND i % 30 = 20;
SELECT roaring_index_count('rbi_cnt_c10', 0) = (SELECT count(*) FROM rbi_cnt WHERE c10 = 0) AS agrees_in_subxact;
 agrees_in_subxact 
-------------------
 t
(1 row)

ROLLBACK TO s;
SELECT roaring_index_count('rbi_cnt_c10', 0) = (SELECT count(*) FROM rbi_cnt WHERE c10 = 0) AS agrees_after_rollback_to;
 agrees_after_rollback_to 
--------------------------
 t
(1 row)

ROLLBACK;
SELECT rbi_ccmp('rbi_cnt_c10', 'rbi_cnt', 'c10', '0');
 rbi_ccmp 
----------
 ok 10000
(1 row)

BEGIN ISOLATION LEVEL READ COMMITTED;
SELECT roaring_index_count('rbi_cnt_c10', 0) = (SELECT count(*) FROM rbi_cnt WHERE c10 = 0) AS agrees;
 agrees 
--------
 t
(1 row)

DELETE FROM rbi_cnt WHERE c10 = 0 AND i % 50 = 30;
SELECT roaring_index_count('rbi_cnt_c10', 0) = (SELECT count(*) FROM rbi_cnt WHERE c10 = 0) AS agrees_after_own_delete;
 agrees_after_own_delete 
-------------------------
 t
(1 row)

ROLLBACK;
-- Serializable transactions must take the same predicate locks an
-- index-only scan would, and must still produce the right answer.
BEGIN ISOLATION LEVEL SERIALIZABLE;
SELECT rbi_ccmp('rbi_cnt_c10', 'rbi_cnt', 'c10', '0');
 rbi_ccmp 
----------
 ok 10000
(1 row)

SELECT rbi_ccmp('rbi_cnt_c5000', 'rbi_cnt', 'c5000', '1234');
 rbi_ccmp 
----------
 ok 40
(1 row)

COMMIT;
/*
 * The batched heap recheck.
 *
 * Blocks that are not all-visible are visited one BLOCK at a time: the buffer
 * is read and share-locked once and every TID of the posting set that lives
 * on it is resolved under that one lock (rbi_count.c, rbi_recheck_heap_heap).
 * roaring_index_count_stats() reports both numbers, so a posting set that is
 * dense enough to put many members on one page must report far fewer blocks
 * than TIDs -- that ratio IS the batching.
 *
 * The table is also the HOT test.  fillfactor leaves room on every page, and
 * payload is in no index, so UPDATEs of it are HOT: the index keeps pointing
 * at the root of the chain and the recheck has to follow the chain to find
 * the version this snapshot can see.  That is what heap_hot_search_buffer()
 * does, and getting it wrong would show up as a count that disagrees with
 * count(*) -- or, with a broken chain walk, as a count that agrees today and
 * not after the second UPDATE.
 */
CREATE TABLE rbi_cnt_hot (id int4 NOT NULL, k int4 NOT NULL, g int4 NOT NULL,
						  payload int4 NOT NULL) WITH (fillfactor = 50);
INSERT INTO rbi_cnt_hot
SELECT i, i % 5, i % 37, 0 FROM generate_series(1, 20000) i;
CREATE INDEX rbi_cnt_hot_k ON rbi_cnt_hot USING roaring (k);
CREATE INDEX rbi_cnt_hot_g ON rbi_cnt_hot USING roaring (g);
VACUUM ANALYZE rbi_cnt_hot;
-- everything all-visible: no heap visit, so no blocks either
SELECT count = 4000 AS count_ok, blocks_skipped > 0 AS skipped_some,
       tids_rechecked = 0 AS nothing_rechecked,
       blocks_rechecked = 0 AS no_blocks_rechecked
  FROM roaring_index_count_stats('rbi_cnt_hot_k', 0);
 count_ok | skipped_some | nothing_rechecked | no_blocks_rechecked 
----------+--------------+-------------------+---------------------
 t        | t            | t                 | t
(1 row)

-- HOT updates: the chains the recheck has to walk.  A HOT update adds no
-- index entry, which is exactly why the index's TID count must not move.
UPDATE rbi_cnt_hot SET payload = payload + 1 WHERE id % 3 = 0;
UPDATE rbi_cnt_hot SET payload = payload + 1 WHERE id % 6 = 0;
SELECT ntids = 20000 AS index_unchanged_by_hot_updates
  FROM roaring_index_stats('rbi_cnt_hot_k');
 index_unchanged_by_hot_updates 
--------------------------------
 t
(1 row)

DELETE FROM rbi_cnt_hot WHERE id % 7 = 0;
/*
 * Every page has been touched by now, so the whole posting set comes back
 * through the recheck: 4000 TIDs on a couple of hundred blocks.
 */
SELECT count = (SELECT count(*) FROM rbi_cnt_hot WHERE k = 0) AS count_ok,
       tids_rechecked = 4000 AS all_rechecked,
       blocks_rechecked > 0 AS visited_blocks,
       blocks_rechecked * 10 < tids_rechecked AS batched_by_block
  FROM roaring_index_count_stats('rbi_cnt_hot_k', 0);
 count_ok | all_rechecked | visited_blocks | batched_by_block 
----------+---------------+----------------+------------------
 t        | t             | t              | t
(1 row)

SELECT rbi_ccmp('rbi_cnt_hot_k', 'rbi_cnt_hot', 'k', '0');
 rbi_ccmp 
----------
 ok 3429
(1 row)

SELECT rbi_ccmp('rbi_cnt_hot_k', 'rbi_cnt_hot', 'k', '3');
 rbi_ccmp 
----------
 ok 3429
(1 row)

SELECT rbi_ccmp('rbi_cnt_hot_g', 'rbi_cnt_hot', 'g', '0');
 rbi_ccmp 
----------
 ok 463
(1 row)

SELECT rbi_ccmp2('rbi_cnt_hot_k', '1', 'rbi_cnt_hot_g', '11',
				 'rbi_cnt_hot', 'k', 'g');
 rbi_ccmp2 
-----------
 ok 93
(1 row)

-- A third update on top of the deleted rows: longer chains, and roots whose
-- chain ends in a dead tuple.
UPDATE rbi_cnt_hot SET payload = payload + 1 WHERE id % 11 = 0;
SELECT rbi_ccmp('rbi_cnt_hot_k', 'rbi_cnt_hot', 'k', '0');
 rbi_ccmp 
----------
 ok 3429
(1 row)

SELECT rbi_ccmp('rbi_cnt_hot_k', 'rbi_cnt_hot', 'k', '4');
 rbi_ccmp 
----------
 ok 3428
(1 row)

/*
 * The same thing in a SERIALIZABLE transaction.  The recheck resolves each
 * TID with heap_hot_search_buffer(), which is the function the table AM's own
 * fetch uses, so it takes the same per-tuple predicate locks; the all-visible
 * blocks that are never looked at are locked page-wise.  Either way a
 * serializable reader must leave SIReadLocks behind on the table.
 */
BEGIN ISOLATION LEVEL SERIALIZABLE;
SELECT rbi_ccmp('rbi_cnt_hot_k', 'rbi_cnt_hot', 'k', '0');
 rbi_ccmp 
----------
 ok 3429
(1 row)

SELECT rbi_ccmp2('rbi_cnt_hot_k', '2', 'rbi_cnt_hot_g', '5',
				 'rbi_cnt_hot', 'k', 'g');
 rbi_ccmp2 
-----------
 ok 92
(1 row)

SELECT count(*) > 0 AS took_predicate_locks
  FROM pg_locks
 WHERE mode = 'SIReadLock'
   AND relation = 'rbi_cnt_hot'::regclass;
 took_predicate_locks 
----------------------
 t
(1 row)

COMMIT;
-- ... and once more with every block all-visible again.
VACUUM rbi_cnt_hot;
BEGIN ISOLATION LEVEL SERIALIZABLE;
SELECT rbi_ccmp('rbi_cnt_hot_k', 'rbi_cnt_hot', 'k', '0');
 rbi_ccmp 
----------
 ok 3429
(1 row)

SELECT count(*) > 0 AS took_predicate_locks
  FROM pg_locks
 WHERE mode = 'SIReadLock'
   AND relation = 'rbi_cnt_hot'::regclass;
 took_predicate_locks 
----------------------
 t
(1 row)

COMMIT;
SELECT count = (SELECT count(*) FROM rbi_cnt_hot WHERE k = 0) AS count_ok,
       tids_rechecked = 0 AS nothing_rechecked,
       blocks_rechecked = 0 AS no_blocks_rechecked
  FROM roaring_index_count_stats('rbi_cnt_hot_k', 0);
 count_ok | nothing_rechecked | no_blocks_rechecked 
----------+-------------------+---------------------
 t        | t                 | t
(1 row)

/*
 * The GROUP BY path of DESIGN.md section 10 intersects the same WHERE posting
 * sets with every group, and rbi_count.c answers those from a materialized
 * copy after the first group (the group's own set is still read page by page,
 * which is what keeps the visibility-map interlock).  The pushdown is what
 * drives that code, so this one section turns it on -- and compares it
 * against the same query with the pushdown off, which is the reference.
 */
SET roaring_index.enable_count_pushdown = on;
CREATE TEMP TABLE rbi_grp_on AS
SELECT g, count(*) AS n FROM rbi_cnt_hot WHERE k = 0 GROUP BY g;
CREATE TEMP TABLE rbi_grp_on2 AS
SELECT g, count(*) AS n FROM rbi_cnt_hot GROUP BY g;
SET roaring_index.enable_count_pushdown = off;
CREATE TEMP TABLE rbi_grp_off AS
SELECT g, count(*) AS n FROM rbi_cnt_hot WHERE k = 0 GROUP BY g;
CREATE TEMP TABLE rbi_grp_off2 AS
SELECT g, count(*) AS n FROM rbi_cnt_hot GROUP BY g;
SELECT (SELECT count(*) FROM (SELECT * FROM rbi_grp_on EXCEPT ALL SELECT * FROM rbi_grp_off) x) AS extra_rows,
       (SELECT count(*) FROM (SELECT * FROM rbi_grp_off EXCEPT ALL SELECT * FROM rbi_grp_on) x) AS missing_rows,
       (SELECT count(*) FROM rbi_grp_on) AS groups;
 extra_rows | missing_rows | groups 
------------+--------------+--------
          0 |            0 |     37
(1 row)

SELECT (SELECT count(*) FROM (SELECT * FROM rbi_grp_on2 EXCEPT ALL SELECT * FROM rbi_grp_off2) x) AS extra_rows,
       (SELECT count(*) FROM (SELECT * FROM rbi_grp_off2 EXCEPT ALL SELECT * FROM rbi_grp_on2) x) AS missing_rows,
       (SELECT count(*) FROM rbi_grp_on2) AS groups;
 extra_rows | missing_rows | groups 
------------+--------------+--------
          0 |            0 |     37
(1 row)

-- and again with the dirty heap under it, so the materialized WHERE set is
-- ANDed against groups whose blocks all go through the recheck
DELETE FROM rbi_cnt_hot WHERE id % 13 = 0;
SET roaring_index.enable_count_pushdown = on;
CREATE TEMP TABLE rbi_grp_on3 AS
SELECT g, count(*) AS n FROM rbi_cnt_hot WHERE k = 0 GROUP BY g;
SET roaring_index.enable_count_pushdown = off;
CREATE TEMP TABLE rbi_grp_off3 AS
SELECT g, count(*) AS n FROM rbi_cnt_hot WHERE k = 0 GROUP BY g;
SELECT (SELECT count(*) FROM (SELECT * FROM rbi_grp_on3 EXCEPT ALL SELECT * FROM rbi_grp_off3) x) AS extra_rows,
       (SELECT count(*) FROM (SELECT * FROM rbi_grp_off3 EXCEPT ALL SELECT * FROM rbi_grp_on3) x) AS missing_rows,
       (SELECT sum(n) FROM rbi_grp_on3) AS total;
 extra_rows | missing_rows | total 
------------+--------------+-------
          0 |            0 |  3165
(1 row)

DROP TABLE rbi_grp_on, rbi_grp_on2, rbi_grp_on3,
		   rbi_grp_off, rbi_grp_off2, rbi_grp_off3;
/* Error cases. */
-- wrong key type
SELECT roaring_index_count('rbi_cnt_c10', 'nope'::text);
ERROR:  type text cannot be compared with index "rbi_cnt_c10"
SELECT roaring_index_count('rbi_cnt_t1000', 1);
ERROR:  type integer cannot be compared with index "rbi_cnt_t1000"
-- not a roaring index
CREATE INDEX rbi_cnt_btree ON rbi_cnt (c10);
SELECT roaring_index_count('rbi_cnt_btree', 0);
ERROR:  index "rbi_cnt_btree" is not a roaring index
-- not an index at all
SELECT roaring_index_count('rbi_cnt', 0);
ERROR:  "rbi_cnt" is not an index
-- two indexes on different tables
CREATE TABLE rbi_cnt_other (k int4);
CREATE INDEX rbi_cnt_other_k ON rbi_cnt_other USING roaring (k);
SELECT roaring_index_count('rbi_cnt_c10', 0, 'rbi_cnt_other_k', 0);
ERROR:  indexes "rbi_cnt_c10" and "rbi_cnt_other_k" are not on the same table
-- NULL arguments: STRICT
SELECT roaring_index_count('rbi_cnt_c10', NULL::int4) IS NULL AS null_key;
 null_key 
----------
 t
(1 row)

SELECT roaring_index_count(NULL, 0) IS NULL AS null_index;
 null_index 
------------
 t
(1 row)

DROP TABLE rbi_cnt_other;
DROP TABLE rbi_cnt_hot;
DROP TABLE rbi_cnt_tiny;
DROP TABLE rbi_cnt;
DROP FUNCTION rbi_ccmp(text, text, text, text);
DROP FUNCTION rbi_ccmp2(text, text, text, text, text, text, text);
