-- Plain index scans: amgettuple (DESIGN.md §29).
--
-- A lion index answers a plain Index Scan by streaming the bitmap path's own
-- set algebra one container at a time.  Every answer below is checked
-- against a SEQUENTIAL SCAN, as a multiset in both directions, and the plan
-- is checked to really be an Index Scan on a lion index.
\set VERBOSITY terse
SET client_min_messages = warning;
LOAD 'pg_lion';
CREATE EXTENSION IF NOT EXISTS pg_lion;
CREATE EXTENSION IF NOT EXISTS citext;
CREATE EXTENSION IF NOT EXISTS pg_lion_citext;
RESET client_min_messages;
SET synchronous_commit = on;
SET default_statistics_target = 1000;
SET max_parallel_workers_per_gather = 0;
/*
 * lion_iq() runs a query as a PLAIN INDEX SCAN - sequential, bitmap and
 * index-only scans disabled, the count pushdown off - and again as a
 * sequential scan, compares the two, and names the lion index the plan
 * scanned (or says there was none: a collation the index cannot answer).
 */
CREATE FUNCTION lion_iq(q text) RETURNS text
LANGUAGE plpgsql AS $$
DECLARE
	ln text;
	used text := NULL;
	nrows bigint;
	ndiff bigint;
BEGIN
	PERFORM set_config('pg_lion.enable_count_pushdown', 'off', true);
	PERFORM set_config('enable_seqscan', 'off', true);
	PERFORM set_config('enable_bitmapscan', 'off', true);
	PERFORM set_config('enable_indexonlyscan', 'off', true);
	PERFORM set_config('enable_indexscan', 'on', true);
	FOR ln IN EXECUTE 'EXPLAIN (COSTS OFF) ' || q LOOP
		IF ln ~ 'Index Scan using lis' AND used IS NULL THEN
			used := substring(ln from 'Index Scan using (\S+)');
		END IF;
	END LOOP;
	EXECUTE format('CREATE TEMP TABLE lion_iq_on AS SELECT s::text AS r FROM (%s) s', q);

	PERFORM set_config('enable_seqscan', 'on', true);
	PERFORM set_config('enable_indexscan', 'off', true);
	EXECUTE format('CREATE TEMP TABLE lion_iq_off AS SELECT s::text AS r FROM (%s) s', q);
	PERFORM set_config('enable_indexscan', 'on', true);
	PERFORM set_config('enable_bitmapscan', 'on', true);
	PERFORM set_config('enable_indexonlyscan', 'on', true);
	PERFORM set_config('pg_lion.enable_count_pushdown', 'on', true);

	EXECUTE 'SELECT count(*) FROM lion_iq_on' INTO nrows;
	EXECUTE 'SELECT (SELECT count(*) FROM (SELECT * FROM lion_iq_on EXCEPT ALL SELECT * FROM lion_iq_off) a)'
			' + (SELECT count(*) FROM (SELECT * FROM lion_iq_off EXCEPT ALL SELECT * FROM lion_iq_on) b)'
		INTO ndiff;
	EXECUTE 'DROP TABLE lion_iq_on, lion_iq_off';
	IF ndiff <> 0 THEN
		RETURN format('MISMATCH: %s rows differ', ndiff);
	END IF;
	RETURN format('%s, %s rows',
				  CASE WHEN used IS NULL THEN 'no index scan'
					   ELSE 'index scan on ' || used END, nrows);
END $$;
/*
 * lion_ir() runs a plain index scan under EXPLAIN ANALYZE and reports the
 * index it used and how many rows the heap recheck of the index quals threw
 * away - which is only ever non-zero when the scan set xs_recheck.
 */
CREATE FUNCTION lion_ir(q text) RETURNS SETOF text
LANGUAGE plpgsql AS $$
DECLARE
	ln text;
BEGIN
	PERFORM set_config('pg_lion.enable_count_pushdown', 'off', true);
	PERFORM set_config('enable_seqscan', 'off', true);
	PERFORM set_config('enable_bitmapscan', 'off', true);
	PERFORM set_config('enable_indexonlyscan', 'off', true);
	FOR ln IN EXECUTE 'EXPLAIN (ANALYZE, COSTS OFF, TIMING OFF, SUMMARY OFF) ' || q LOOP
		IF ln ~ 'Index Scan using' THEN
			RETURN NEXT 'Index Scan using ' || substring(ln from 'Index Scan using (\S+)');
		ELSIF ln ~ 'Rows Removed by Index Recheck' THEN
			RETURN NEXT btrim(ln);
		END IF;
	END LOOP;
	PERFORM set_config('enable_seqscan', 'on', true);
	PERFORM set_config('enable_bitmapscan', 'on', true);
	PERFORM set_config('enable_indexonlyscan', 'on', true);
	PERFORM set_config('pg_lion.enable_count_pushdown', 'on', true);
END $$;
/*
 * lion_ios() runs a query that needs no column as an INDEX-ONLY scan on a lion
 * index (DESIGN.md §29.9: lion returns no column, so this is the only kind the
 * planner can build) and compares it with a sequential scan.
 */
CREATE FUNCTION lion_ios(q text) RETURNS text
LANGUAGE plpgsql AS $$
DECLARE
	ln text;
	used text := NULL;
	a text;
	b text;
BEGIN
	PERFORM set_config('pg_lion.enable_count_pushdown', 'off', true);
	PERFORM set_config('enable_seqscan', 'off', true);
	PERFORM set_config('enable_bitmapscan', 'off', true);
	FOR ln IN EXECUTE 'EXPLAIN (COSTS OFF) ' || q LOOP
		IF ln ~ 'Index Only Scan using lis' AND used IS NULL THEN
			used := substring(ln from 'Index Only Scan using (\S+)');
		END IF;
	END LOOP;
	EXECUTE q INTO a;
	PERFORM set_config('enable_seqscan', 'on', true);
	PERFORM set_config('enable_indexonlyscan', 'off', true);
	EXECUTE q INTO b;
	PERFORM set_config('enable_indexonlyscan', 'on', true);
	PERFORM set_config('enable_bitmapscan', 'on', true);
	PERFORM set_config('pg_lion.enable_count_pushdown', 'on', true);
	IF a IS DISTINCT FROM b THEN
		RETURN format('MISMATCH: %s against %s', a, b);
	END IF;
	RETURN format('%s: %s', coalesce('index-only scan on ' || used, 'no index-only scan'), a);
END $$;
/* The first line of a plan with nothing disabled. */
CREATE FUNCTION lion_top(q text) RETURNS text
LANGUAGE plpgsql AS $$
DECLARE
	ln text;
	res text := '';
BEGIN
	FOR ln IN EXECUTE 'EXPLAIN (COSTS OFF) ' || q LOOP
		IF ln ~ '(Scan|LionCount)' THEN
			res := res || CASE WHEN res = '' THEN '' ELSE ' / ' END ||
				   btrim(regexp_replace(ln, '->', ''));
		END IF;
	END LOOP;
	RETURN res;
END $$;
-- ---------- 1. the predicate kinds, each as a forced plain index scan ----------
CREATE TABLE lis (
	id		int NOT NULL,
	k		int NOT NULL,
	kk		int NOT NULL,		-- k again, for the multicolumn index
	u		int NOT NULL,
	g		int NOT NULL,
	n		int,
	t		text NOT NULL,
	ci		citext NOT NULL,
	tags	int[],
	tsv		tsvector,
	flag	bool NOT NULL,
	flag2	bool NOT NULL,
	pad		text
);
INSERT INTO lis
SELECT i, (i * 7919) % 200, (i * 7919) % 200, i, i % 10,
	   CASE WHEN i % 7 = 0 THEN NULL ELSE i % 50 END,
	   'v' || (i % 50),
	   CASE i % 3 WHEN 0 THEN 'alice' WHEN 1 THEN 'ALICE' ELSE 'Bob' || (i % 5) END,
	   CASE WHEN i % 11 = 0 THEN NULL
			WHEN i % 13 = 0 THEN '{}'::int[]
			ELSE ARRAY[i % 10, 10 + i % 17, 40 + i % 23] END,
	   CASE WHEN i % 11 = 0 THEN NULL
			ELSE to_tsvector('simple', 'w' || (i % 10) || ' x' || (i % 7)) END,
	   i % 97 = 0, i % 89 = 0,
	   repeat('p', 20)
  FROM generate_series(1, 30000) i;
CREATE INDEX lis_k ON lis USING lion (k);
CREATE INDEX lis_u ON lis USING lion (u);
CREATE INDEX lis_n ON lis USING lion (n);
CREATE INDEX lis_t ON lis USING lion (t);
CREATE INDEX lis_ci ON lis USING lion (ci);
CREATE INDEX lis_tags ON lis USING lion (tags);
CREATE INDEX lis_tsv ON lis USING lion (tsv);
CREATE INDEX lis_gk ON lis USING lion (g, kk);
CREATE INDEX lis_part ON lis USING lion (g) WHERE flag;
CREATE INDEX lis_tpart ON lis USING lion (tags) WHERE flag2;
ANALYZE lis;
-- equality, and a key that is not there
SELECT lion_iq('SELECT id FROM lis WHERE k = 17');
            lion_iq            
-------------------------------
 index scan on lis_k, 150 rows
(1 row)

SELECT lion_iq('SELECT id FROM lis WHERE u = 12345');
           lion_iq           
-----------------------------
 index scan on lis_u, 1 rows
(1 row)

SELECT lion_iq('SELECT id FROM lis WHERE u = -1');
           lion_iq           
-----------------------------
 index scan on lis_u, 0 rows
(1 row)

-- IN lists and = ANY, NULL elements, duplicates, nothing left
SELECT lion_iq('SELECT id FROM lis WHERE k IN (1, 2, 3, 150)');
            lion_iq            
-------------------------------
 index scan on lis_k, 600 rows
(1 row)

SELECT lion_iq('SELECT id FROM lis WHERE k = ANY (''{5, NULL, 7, 5}''::int[])');
            lion_iq            
-------------------------------
 index scan on lis_k, 300 rows
(1 row)

SELECT lion_iq('SELECT id FROM lis WHERE k = ANY (''{NULL}''::int[])');
           lion_iq           
-----------------------------
 index scan on lis_k, 0 rows
(1 row)

SELECT lion_iq('SELECT id FROM lis WHERE k = ANY (''{}''::int[])');
           lion_iq           
-----------------------------
 index scan on lis_k, 0 rows
(1 row)

SELECT lion_iq('SELECT id FROM lis WHERE u IN (1, 29999, 30000, 30001)');
           lion_iq           
-----------------------------
 index scan on lis_u, 3 rows
(1 row)

-- ranges: one walk, bounded both ways, open-ended, empty, and against an array
SELECT lion_iq('SELECT id FROM lis WHERE k BETWEEN 10 AND 20');
            lion_iq             
--------------------------------
 index scan on lis_k, 1650 rows
(1 row)

SELECT lion_iq('SELECT id FROM lis WHERE k > 190');
            lion_iq             
--------------------------------
 index scan on lis_k, 1350 rows
(1 row)

SELECT lion_iq('SELECT id FROM lis WHERE k < 3');
            lion_iq            
-------------------------------
 index scan on lis_k, 450 rows
(1 row)

SELECT lion_iq('SELECT id FROM lis WHERE k > 5 AND k < 5');
           lion_iq           
-----------------------------
 index scan on lis_k, 0 rows
(1 row)

SELECT lion_iq('SELECT id FROM lis WHERE u >= 29990');
           lion_iq            
------------------------------
 index scan on lis_u, 11 rows
(1 row)

SELECT lion_iq('SELECT id FROM lis WHERE k < ANY (''{5, 10, NULL}''::int[])');
            lion_iq             
--------------------------------
 index scan on lis_k, 1500 rows
(1 row)

SELECT lion_iq('SELECT id FROM lis WHERE k > ANY (''{195, 190}''::int[])');
            lion_iq             
--------------------------------
 index scan on lis_k, 1350 rows
(1 row)

-- NULL tests
SELECT lion_iq('SELECT id FROM lis WHERE n IS NULL');
            lion_iq             
--------------------------------
 index scan on lis_n, 4285 rows
(1 row)

SELECT lion_iq('SELECT id FROM lis WHERE n IS NOT NULL');
             lion_iq             
---------------------------------
 index scan on lis_n, 25715 rows
(1 row)

SELECT lion_iq('SELECT id FROM lis WHERE n = ANY (''{3, NULL}''::int[])');
            lion_iq            
-------------------------------
 index scan on lis_n, 514 rows
(1 row)

-- two quals on one column: one answered, the other rechecked
SELECT lion_iq('SELECT id FROM lis WHERE k IN (17, 18) AND k IN (18, 19)');
            lion_iq            
-------------------------------
 index scan on lis_k, 150 rows
(1 row)

SELECT lion_iq('SELECT id FROM lis WHERE k = 17 AND k > 10');
            lion_iq            
-------------------------------
 index scan on lis_k, 150 rows
(1 row)

SELECT lion_ir('SELECT id FROM lis WHERE k IN (17, 18) AND k IN (18, 19)');
              lion_ir               
------------------------------------
 Index Scan using lis_k
 Rows Removed by Index Recheck: 150
(2 rows)

-- a multicolumn index: sets ANDed, a range walked with the other column's sets,
-- two ranges (one walked, one rechecked), and the second column alone
SELECT lion_iq('SELECT id FROM lis WHERE g = 3 AND kk = 17');
            lion_iq             
--------------------------------
 index scan on lis_gk, 150 rows
(1 row)

SELECT lion_iq('SELECT id FROM lis WHERE g IN (1, 2) AND kk IN (9, 18, 28, 19, 5)');
            lion_iq             
--------------------------------
 index scan on lis_gk, 600 rows
(1 row)

SELECT lion_iq('SELECT id FROM lis WHERE g = 3 AND kk BETWEEN 10 AND 60');
            lion_iq             
--------------------------------
 index scan on lis_gk, 750 rows
(1 row)

SELECT lion_iq('SELECT id FROM lis WHERE g BETWEEN 1 AND 3 AND kk BETWEEN 10 AND 60');
             lion_iq             
---------------------------------
 index scan on lis_gk, 2250 rows
(1 row)

SELECT lion_ir('SELECT id FROM lis WHERE g BETWEEN 1 AND 3 AND kk BETWEEN 10 AND 60');
               lion_ir               
-------------------------------------
 Index Scan using lis_gk
 Rows Removed by Index Recheck: 6750
(2 rows)

SELECT lion_iq('SELECT id FROM lis WHERE g IN (1, 2) AND kk BETWEEN 190 AND 200');
            lion_iq             
--------------------------------
 index scan on lis_gk, 300 rows
(1 row)

SELECT lion_iq('SELECT id FROM lis WHERE kk = 5');
            lion_iq             
--------------------------------
 index scan on lis_gk, 150 rows
(1 row)

-- cross-type keys (the family's int4/int8 members) and a binary-coerced varchar
SELECT lion_iq('SELECT id FROM lis WHERE k = 17::int8');
            lion_iq            
-------------------------------
 index scan on lis_k, 150 rows
(1 row)

SELECT lion_iq('SELECT id FROM lis WHERE k = ANY (''{17, 18, 5000000000}''::int8[])');
            lion_iq            
-------------------------------
 index scan on lis_k, 300 rows
(1 row)

SELECT lion_iq('SELECT id FROM lis WHERE k < 5000000000::int8');
             lion_iq             
---------------------------------
 index scan on lis_k, 30000 rows
(1 row)

SELECT lion_iq('SELECT id FROM lis WHERE k > 5000000000::int8');
           lion_iq           
-----------------------------
 index scan on lis_k, 0 rows
(1 row)

SELECT lion_iq('SELECT id FROM lis WHERE t = ''v7''::varchar');
            lion_iq            
-------------------------------
 index scan on lis_t, 600 rows
(1 row)

-- citext: one entry for both spellings
SELECT lion_iq('SELECT id FROM lis WHERE ci = ''Alice''');
             lion_iq              
----------------------------------
 index scan on lis_ci, 20000 rows
(1 row)

SELECT lion_iq('SELECT id FROM lis WHERE ci IN (''BOB1'', ''bob2'')');
             lion_iq             
---------------------------------
 index scan on lis_ci, 4000 rows
(1 row)

-- a collation the index was not built under is not answered by it
SELECT lion_iq('SELECT id FROM lis WHERE t = ''v7'' COLLATE "POSIX"');
         lion_iq         
-------------------------
 no index scan, 600 rows
(1 row)

-- arrays: exact queries (rechecked all the same) and ones that need every row
SELECT lion_iq('SELECT id FROM lis WHERE tags @> ''{3}''');
              lion_iq              
-----------------------------------
 index scan on lis_tags, 2517 rows
(1 row)

SELECT lion_iq('SELECT id FROM lis WHERE tags @> ''{3, 13}''');
             lion_iq              
----------------------------------
 index scan on lis_tags, 149 rows
(1 row)

SELECT lion_iq('SELECT id FROM lis WHERE tags && ''{3, 50}''');
              lion_iq              
-----------------------------------
 index scan on lis_tags, 3502 rows
(1 row)

SELECT lion_iq('SELECT id FROM lis WHERE tags <@ ''{1, 11, 41, 2, 12, 42}''');
              lion_iq              
-----------------------------------
 index scan on lis_tags, 2150 rows
(1 row)

SELECT lion_iq('SELECT id FROM lis WHERE tags @> ''{}''');
              lion_iq               
------------------------------------
 index scan on lis_tags, 27273 rows
(1 row)

SELECT lion_iq('SELECT id FROM lis WHERE tags IS NULL');
              lion_iq              
-----------------------------------
 index scan on lis_tags, 2727 rows
(1 row)

SELECT lion_iq('SELECT id FROM lis WHERE tags IS NOT NULL');
              lion_iq               
------------------------------------
 index scan on lis_tags, 27273 rows
(1 row)

SELECT lion_ir('SELECT id FROM lis WHERE tags <@ ''{1, 11, 41, 2, 12, 42}''');
               lion_ir                
--------------------------------------
 Index Scan using lis_tags
 Rows Removed by Index Recheck: 25123
(2 rows)

-- tsvector: a tree of lexemes, and a NOT, which needs every row
SELECT lion_iq('SELECT id FROM lis WHERE tsv @@ ''w3 & x2''::tsquery');
             lion_iq             
---------------------------------
 index scan on lis_tsv, 390 rows
(1 row)

SELECT lion_iq('SELECT id FROM lis WHERE tsv @@ ''w3 | x5''::tsquery');
             lion_iq              
----------------------------------
 index scan on lis_tsv, 6233 rows
(1 row)

SELECT lion_iq('SELECT id FROM lis WHERE tsv @@ ''w3 & !x2''::tsquery');
             lion_iq              
----------------------------------
 index scan on lis_tsv, 2337 rows
(1 row)

SELECT lion_ir('SELECT id FROM lis WHERE tsv @@ ''w3 & !x2''::tsquery');
               lion_ir                
--------------------------------------
 Index Scan using lis_tsv
 Rows Removed by Index Recheck: 24936
(2 rows)

-- partial indexes answered with no key at all: a scalar column and a multi-key one
SELECT lion_iq('SELECT id FROM lis WHERE flag');
             lion_iq              
----------------------------------
 index scan on lis_part, 309 rows
(1 row)

SELECT lion_iq('SELECT id FROM lis WHERE flag2');
              lion_iq              
-----------------------------------
 index scan on lis_tpart, 337 rows
(1 row)

-- a query that needs no column at all can be an index-only scan: every row of
-- a column's walk (NULLs included), or of a multi-key column's bitmap
SELECT lion_ios('SELECT count(*) FROM lis');
            lion_ios             
---------------------------------
 index-only scan on lis_u: 30000
(1 row)

SELECT lion_ios('SELECT count(*) FROM lis WHERE flag');
             lion_ios             
----------------------------------
 index-only scan on lis_part: 309
(1 row)

SELECT lion_ios('SELECT count(*) FROM lis WHERE flag2');
             lion_ios              
-----------------------------------
 index-only scan on lis_tpart: 337
(1 row)

-- ---------- 2. nested-loop inner index scans, rescanned per outer row ----------
CREATE TABLE lis_outer (x int, arr int[]);
INSERT INTO lis_outer SELECT i * 97, ARRAY[i % 200, (i * 3) % 200] FROM generate_series(1, 60) i;
ANALYZE lis_outer;
SET enable_hashjoin = off;
SET enable_mergejoin = off;
SET enable_material = off;
SELECT lion_iq('SELECT o.x, l.id FROM lis_outer o JOIN lis l ON l.u = o.x');
           lion_iq            
------------------------------
 index scan on lis_u, 60 rows
(1 row)

SELECT lion_iq('SELECT o.x, l.id FROM lis_outer o JOIN lis l ON l.k = ANY (o.arr)');
             lion_iq             
---------------------------------
 index scan on lis_k, 18000 rows
(1 row)

SELECT lion_iq('SELECT o.x, l.id FROM lis_outer o JOIN lis l ON l.u BETWEEN o.x AND o.x + 5');
            lion_iq            
-------------------------------
 index scan on lis_u, 360 rows
(1 row)

SELECT lion_iq('SELECT o.x, l.id FROM lis_outer o JOIN lis l ON l.g = o.x % 10 AND l.kk = o.x % 200');
             lion_iq             
---------------------------------
 index scan on lis_gk, 1800 rows
(1 row)

RESET enable_hashjoin;
RESET enable_mergejoin;
RESET enable_material;
-- ---------- 3. cursors ----------
SET pg_lion.enable_count_pushdown = off;
SET enable_seqscan = off;
SET enable_bitmapscan = off;
BEGIN;
EXPLAIN (COSTS OFF) DECLARE c CURSOR FOR SELECT id FROM lis WHERE k = 17;
          QUERY PLAN           
-------------------------------
 Index Scan using lis_k on lis
   Index Cond: (k = 17)
(2 rows)

DECLARE c CURSOR FOR SELECT id FROM lis WHERE k = 17;
FETCH 3 FROM c;
 id  
-----
 143
 343
 543
(3 rows)

FETCH 2 FROM c;
 id  
-----
 743
 943
(2 rows)

MOVE FORWARD 100 IN c;
FETCH 2 FROM c;
  id   
-------
 21143
 21343
(2 rows)

FETCH BACKWARD 1 FROM c;		-- a NO SCROLL cursor refuses
ERROR:  cursor can only scan forward
ROLLBACK;
BEGIN;
-- a SCROLL cursor gets a Material node: lion cannot scan backward
EXPLAIN (COSTS OFF) DECLARE s SCROLL CURSOR FOR SELECT id FROM lis WHERE k = 17;
             QUERY PLAN              
-------------------------------------
 Materialize
   ->  Index Scan using lis_k on lis
         Index Cond: (k = 17)
(3 rows)

DECLARE s SCROLL CURSOR FOR SELECT id FROM lis WHERE k = 17;
FETCH 3 FROM s;
 id  
-----
 143
 343
 543
(3 rows)

FETCH BACKWARD 2 FROM s;
 id  
-----
 343
 143
(2 rows)

FETCH ABSOLUTE 5 FROM s;
 id  
-----
 943
(1 row)

FETCH LAST FROM s;
  id   
-------
 29943
(1 row)

FETCH PRIOR FROM s;
  id   
-------
 29743
(1 row)

COMMIT;
RESET enable_seqscan;
RESET enable_bitmapscan;
RESET pg_lion.enable_count_pushdown;
-- ---------- 4. a dirty heap: updates and deletes, then VACUUM ----------
UPDATE lis SET k = (k + 1) % 200, kk = (kk + 1) % 200, tags = tags || 99 WHERE id % 10 = 0;
DELETE FROM lis WHERE id % 13 = 0;
UPDATE lis SET n = NULL WHERE id % 17 = 0;
SELECT lion_iq('SELECT id FROM lis WHERE k = 17');
            lion_iq            
-------------------------------
 index scan on lis_k, 138 rows
(1 row)

SELECT lion_iq('SELECT id FROM lis WHERE k IN (17, 18, 19)');
            lion_iq            
-------------------------------
 index scan on lis_k, 415 rows
(1 row)

SELECT lion_iq('SELECT id FROM lis WHERE k BETWEEN 10 AND 20');
            lion_iq             
--------------------------------
 index scan on lis_k, 1385 rows
(1 row)

SELECT lion_iq('SELECT id FROM lis WHERE n IS NULL');
            lion_iq             
--------------------------------
 index scan on lis_n, 5352 rows
(1 row)

SELECT lion_iq('SELECT id FROM lis WHERE g = 3 AND kk BETWEEN 10 AND 60');
            lion_iq             
--------------------------------
 index scan on lis_gk, 691 rows
(1 row)

SELECT lion_iq('SELECT id FROM lis WHERE tags @> ''{99}''');
              lion_iq              
-----------------------------------
 index scan on lis_tags, 2770 rows
(1 row)

SELECT lion_ios('SELECT count(*) FROM lis WHERE flag');
             lion_ios             
----------------------------------
 index-only scan on lis_part: 286
(1 row)

SELECT lion_ios('SELECT count(*) FROM lis WHERE flag2');
             lion_ios              
-----------------------------------
 index-only scan on lis_tpart: 312
(1 row)

VACUUM lis;
SELECT lion_iq('SELECT id FROM lis WHERE k = 17');
            lion_iq            
-------------------------------
 index scan on lis_k, 138 rows
(1 row)

SELECT lion_iq('SELECT id FROM lis WHERE k IN (17, 18, 19)');
            lion_iq            
-------------------------------
 index scan on lis_k, 415 rows
(1 row)

SELECT lion_iq('SELECT id FROM lis WHERE k BETWEEN 10 AND 20');
            lion_iq             
--------------------------------
 index scan on lis_k, 1385 rows
(1 row)

SELECT lion_iq('SELECT id FROM lis WHERE n IS NULL');
            lion_iq             
--------------------------------
 index scan on lis_n, 5352 rows
(1 row)

SELECT lion_iq('SELECT id FROM lis WHERE g = 3 AND kk BETWEEN 10 AND 60');
            lion_iq             
--------------------------------
 index scan on lis_gk, 691 rows
(1 row)

SELECT lion_iq('SELECT id FROM lis WHERE tags @> ''{99}''');
              lion_iq              
-----------------------------------
 index scan on lis_tags, 2770 rows
(1 row)

SELECT lion_ios('SELECT count(*) FROM lis WHERE flag');
             lion_ios             
----------------------------------
 index-only scan on lis_part: 286
(1 row)

SELECT lion_ios('SELECT count(*) FROM lis WHERE flag2');
             lion_ios              
-----------------------------------
 index-only scan on lis_tpart: 312
(1 row)

SELECT lion_index_verify('lis_k', true);
 lion_index_verify 
-------------------
 
(1 row)

-- ---------- 5. a posting set far larger than one batch, streamed ----------
-- 150k narrow rows over three keys: every key's posting set is a posting
-- tree of many containers.  A cursor walks one of them; the scan's memory is
-- the same after a thousand rows as after forty-one thousand.
CREATE TABLE lis_big (id int, b int);
INSERT INTO lis_big SELECT i, i % 3 FROM generate_series(1, 150000) i;
CREATE INDEX lis_big_b ON lis_big USING lion (b);
ANALYZE lis_big;
SELECT container_pages > 3 AS is_a_posting_tree FROM lion_index_stats('lis_big_b');
 is_a_posting_tree 
-------------------
 t
(1 row)

BEGIN;
SET LOCAL pg_lion.enable_count_pushdown = off;
SET LOCAL enable_seqscan = off;
SET LOCAL enable_bitmapscan = off;
EXPLAIN (COSTS OFF) DECLARE big CURSOR FOR SELECT id FROM lis_big WHERE b = 1;
              QUERY PLAN               
---------------------------------------
 Index Scan using lis_big_b on lis_big
   Index Cond: (b = 1)
(2 rows)

DECLARE big CURSOR FOR SELECT id FROM lis_big WHERE b = 1;
MOVE FORWARD 1000 IN big;
CREATE TEMP TABLE lis_mem AS
SELECT sum(total_bytes) AS bytes FROM pg_backend_memory_contexts
 WHERE name LIKE 'lion index scan%';
MOVE FORWARD 40000 IN big;
SELECT count(*) > 0 AS scan_contexts,
	   sum(total_bytes) <= (SELECT bytes FROM lis_mem) AS no_growth,
	   sum(total_bytes) < 1024 * 1024 AS under_1mb
  FROM pg_backend_memory_contexts WHERE name LIKE 'lion index scan%';
 scan_contexts | no_growth | under_1mb 
---------------+-----------+-----------
 t             | t         | t
(1 row)

MOVE FORWARD ALL IN big;
COMMIT;
DROP TABLE lis_mem;
SELECT lion_iq('SELECT count(*), sum(id) FROM lis_big WHERE b = 1');
             lion_iq             
---------------------------------
 index scan on lis_big_b, 1 rows
(1 row)

-- ---------- 6. plan choice with nothing disabled ----------
-- Narrow rows, many to a page: a one-row lookup goes to the plain scan; a
-- key of a few hundred scattered rows goes to the bitmap at the default
-- work_mem and to the plain scan when the bitmap would be lossy.
CREATE TABLE lis_f (id int, k int, u int);
INSERT INTO lis_f SELECT i, (i::int8 * 7919 % 300)::int, i FROM generate_series(1, 600000) i;
CREATE INDEX lis_f_k ON lis_f USING lion (k);
CREATE INDEX lis_f_u ON lis_f USING lion (u);
VACUUM ANALYZE lis_f;
SET pg_lion.enable_count_pushdown = off;
SELECT lion_top('SELECT id FROM lis_f WHERE u = 123456');
             lion_top              
-----------------------------------
 Index Scan using lis_f_u on lis_f
(1 row)

SELECT lion_top('SELECT id FROM lis_f WHERE u IN (1, 123456, 500000)');
             lion_top              
-----------------------------------
 Index Scan using lis_f_u on lis_f
(1 row)

SELECT lion_top('SELECT sum(id) FROM lis_f WHERE k = 17');
                         lion_top                         
----------------------------------------------------------
 Bitmap Heap Scan on lis_f / Bitmap Index Scan on lis_f_k
(1 row)

SET work_mem = '64kB';
SELECT lion_top('SELECT sum(id) FROM lis_f WHERE k = 17');
             lion_top              
-----------------------------------
 Index Scan using lis_f_k on lis_f
(1 row)

RESET work_mem;
RESET pg_lion.enable_count_pushdown;
SELECT id FROM lis_f WHERE u = 123456;
   id   
--------
 123456
(1 row)

SET work_mem = '64kB';
SELECT count(*), sum(id) FROM lis_f WHERE k = 17;
 count |    sum    
-------+-----------
  2000 | 599786000
(1 row)

RESET work_mem;
SELECT count(*), sum(id) FROM lis_f WHERE k = 17;
 count |    sum    
-------+-----------
  2000 | 599786000
(1 row)

-- the count pushdown keeps its shapes
SELECT lion_top('SELECT count(*) FROM lis_f WHERE k = 17');
        lion_top         
-------------------------
 Custom Scan (LionCount)
(1 row)

SELECT lion_top('SELECT count(*) FROM lis_f WHERE u = 123456');
        lion_top         
-------------------------
 Custom Scan (LionCount)
(1 row)

SELECT lion_top('SELECT k, count(*) FROM lis_f GROUP BY k');
        lion_top         
-------------------------
 Custom Scan (LionCount)
(1 row)

-- ---------- 7. exclusion constraints: a non-MVCC (dirty snapshot) scan ----------
CREATE TABLE lis_ex (a int, b text, EXCLUDE USING lion (a WITH =));
INSERT INTO lis_ex VALUES (1, 'one'), (2, 'two'), (3, 'three');
INSERT INTO lis_ex VALUES (2, 'again');
ERROR:  conflicting key value violates exclusion constraint "lis_ex_a_excl"
INSERT INTO lis_ex VALUES (NULL, 'x'), (NULL, 'y');		-- NULLs never conflict
INSERT INTO lis_ex VALUES (4, 'four') ON CONFLICT DO NOTHING;
INSERT INTO lis_ex VALUES (4, 'four again') ON CONFLICT DO NOTHING;
UPDATE lis_ex SET a = 3 WHERE a = 1;
ERROR:  conflicting key value violates exclusion constraint "lis_ex_a_excl"
SELECT a, b FROM lis_ex ORDER BY a, b;
 a |   b   
---+-------
 1 | one
 2 | two
 3 | three
 4 | four
   | x
   | y
(6 rows)

CREATE TABLE lis_ex2 (a int, b int, EXCLUDE USING lion (a WITH =, b WITH =));
INSERT INTO lis_ex2 VALUES (1, 1), (1, 2), (2, 1);
INSERT INTO lis_ex2 VALUES (1, 2);
ERROR:  conflicting key value violates exclusion constraint "lis_ex2_a_b_excl"
INSERT INTO lis_ex2 SELECT i % 100, i / 100 FROM generate_series(1000, 5000) i;
INSERT INTO lis_ex2 VALUES (50, 30);
ERROR:  conflicting key value violates exclusion constraint "lis_ex2_a_b_excl"
SELECT count(*) FROM lis_ex2;
 count 
-------
  4004
(1 row)

-- building the constraint over existing duplicates fails
CREATE TABLE lis_ex3 (a int);
INSERT INTO lis_ex3 VALUES (1), (2), (1);
ALTER TABLE lis_ex3 ADD CONSTRAINT lis_ex3_a EXCLUDE USING lion (a WITH =);
ERROR:  could not create exclusion constraint "lis_ex3_a"
DELETE FROM lis_ex3 WHERE ctid = (SELECT max(ctid) FROM lis_ex3);
ALTER TABLE lis_ex3 ADD CONSTRAINT lis_ex3_a EXCLUDE USING lion (a WITH =);
INSERT INTO lis_ex3 VALUES (2);
ERROR:  conflicting key value violates exclusion constraint "lis_ex3_a"
-- a multi-key exclusion: arrays that overlap conflict
CREATE TABLE lis_ex4 (id int, tags int[], EXCLUDE USING lion (tags WITH &&));
INSERT INTO lis_ex4 VALUES (1, '{1,2}'), (2, '{3}'), (3, '{}'), (4, NULL);
INSERT INTO lis_ex4 VALUES (5, '{2,5}');
ERROR:  conflicting key value violates exclusion constraint "lis_ex4_tags_excl"
INSERT INTO lis_ex4 VALUES (6, '{4,5}'), (7, '{}');
SELECT id, tags FROM lis_ex4 ORDER BY id;
 id | tags  
----+-------
  1 | {1,2}
  2 | {3}
  3 | {}
  4 | 
  6 | {4,5}
  7 | {}
(6 rows)

DROP TABLE lis, lis_outer, lis_big, lis_f, lis_ex, lis_ex2, lis_ex3, lis_ex4;
DROP FUNCTION lion_iq(text);
DROP FUNCTION lion_ir(text);
DROP FUNCTION lion_top(text);
DROP FUNCTION lion_ios(text);
