-- Inserts into a roaring index (DESIGN.md section 5, INSERT).
--
-- Every phase compares index scans with sequential scans and runs
-- roaring_index_verify(idx, true), which also checks that every heap tuple
-- visible to a fresh snapshot is indexed under its key.
\set VERBOSITY terse
SET client_min_messages = warning;
CREATE EXTENSION IF NOT EXISTS roaring_index;
SELECT setseed(0.42);
 setseed 
---------
 
(1 row)

CREATE OR REPLACE FUNCTION rbi_cmp(tbl text, pred text) RETURNS text
LANGUAGE plpgsql AS $$
DECLARE
	q text := format('SELECT count(*) AS c, coalesce(sum(i), 0) AS s FROM %s WHERE %s', tbl, pred);
	a record;
	b record;
	ln text;
	used boolean := false;
BEGIN
	PERFORM set_config('enable_seqscan', 'off', false);
	PERFORM set_config('enable_bitmapscan', 'on', false);
	FOR ln IN EXECUTE 'EXPLAIN (COSTS OFF) ' || q LOOP
		IF ln LIKE '%Bitmap Index Scan%' THEN
			used := true;
		END IF;
	END LOOP;
	EXECUTE q INTO a;

	PERFORM set_config('enable_seqscan', 'on', false);
	PERFORM set_config('enable_bitmapscan', 'off', false);
	EXECUTE q INTO b;
	PERFORM set_config('enable_bitmapscan', 'on', false);

	IF a IS DISTINCT FROM b THEN
		RETURN format('MISMATCH index=%s seqscan=%s', a::text, b::text);
	END IF;
	IF NOT used THEN
		RETURN format('NO BITMAP INDEX SCAN (%s rows)', a.c);
	END IF;
	RETURN format('ok %s rows', a.c);
END $$;
-- The index is built on an empty table, so every TID below arrives through
-- aminsert.
CREATE TABLE rbi_ins (i int4, k int4, t text, b bool);
CREATE INDEX rbi_ins_k ON rbi_ins USING roaring (k);
CREATE INDEX rbi_ins_t ON rbi_ins USING roaring (t);
CREATE INDEX rbi_ins_b ON rbi_ins USING roaring (b);
CREATE OR REPLACE FUNCTION rbi_ins_check(tag text) RETURNS text
LANGUAGE plpgsql AS $$
BEGIN
	PERFORM roaring_index_verify('rbi_ins_k', true);
	PERFORM roaring_index_verify('rbi_ins_t', true);
	PERFORM roaring_index_verify('rbi_ins_b', true);
	RETURN format('%s | k=3 %s | t=v3 %s | t=v7 %s | b %s | k=-1 %s', tag,
				  rbi_cmp('rbi_ins', 'k = 3'),
				  rbi_cmp('rbi_ins', 't = ''v3'''),
				  rbi_cmp('rbi_ins', 't = ''v7'''),
				  rbi_cmp('rbi_ins', 'b'),
				  rbi_cmp('rbi_ins', 'k = -1'));
END $$;
SELECT rbi_ins_check('empty');
                                     rbi_ins_check                                      
----------------------------------------------------------------------------------------
 empty | k=3 ok 0 rows | t=v3 ok 0 rows | t=v7 ok 0 rows | b ok 0 rows | k=-1 ok 0 rows
(1 row)

-- Phase 1: single-row inserts, each its own statement.
INSERT INTO rbi_ins VALUES (1, 1, 'v1', true);
INSERT INTO rbi_ins VALUES (2, 2, 'v2', false);
INSERT INTO rbi_ins VALUES (3, 3, 'v3', true);
INSERT INTO rbi_ins VALUES (4, 3, 'v3', false);
INSERT INTO rbi_ins VALUES (5, 7, 'v7', true);
SELECT rbi_ins_check('single rows');
                                        rbi_ins_check                                         
----------------------------------------------------------------------------------------------
 single rows | k=3 ok 2 rows | t=v3 ok 2 rows | t=v7 ok 1 rows | b ok 3 rows | k=-1 ok 0 rows
(1 row)

SELECT * FROM roaring_index_stats('rbi_ins_k');
 nbuckets | bucket_pages | entries | inline_entries | container_pages | containers | array_containers | bitset_containers | run_containers | ntids | container_bytes | free_bytes | sparse_segments | sparse_members | null_tids | empty_tids | slack_bytes | max_bucket_pages 
----------+--------------+---------+----------------+-----------------+------------+------------------+-------------------+----------------+-------+-----------------+------------+-----------------+----------------+-----------+------------+-------------+------------------
       64 |           64 |       4 |              4 |               0 |          0 |                0 |                 0 |              0 |     5 |              62 |     521224 |               4 |              5 |         0 |          0 |           0 |                1
(1 row)

-- Phase 2: multi-row VALUES.
INSERT INTO rbi_ins VALUES
	(6, 3, 'v3', false), (7, 7, 'v7', true), (8, 11, 'v11', false),
	(9, 3, 'v7', true), (10, 7, 'v3', false);
SELECT rbi_ins_check('multi-row values');
                                           rbi_ins_check                                           
---------------------------------------------------------------------------------------------------
 multi-row values | k=3 ok 4 rows | t=v3 ok 4 rows | t=v7 ok 3 rows | b ok 5 rows | k=-1 ok 0 rows
(1 row)

-- Phase 3: a bulk INSERT ... SELECT.  100k rows over 13 int keys, 7 text
-- keys and 2 booleans.
INSERT INTO rbi_ins
SELECT i, i % 13, 'v' || (i % 7), (i % 3) = 0
  FROM generate_series(11, 100010) i;
SELECT rbi_ins_check('insert select 100k');
                                                 rbi_ins_check                                                  
----------------------------------------------------------------------------------------------------------------
 insert select 100k | k=3 ok 7696 rows | t=v3 ok 14289 rows | t=v7 ok 3 rows | b ok 33338 rows | k=-1 ok 0 rows
(1 row)

SELECT entries, inline_entries, ntids FROM roaring_index_stats('rbi_ins_k');
 entries | inline_entries | ntids  
---------+----------------+--------
      13 |              0 | 100010
(1 row)

SELECT entries, inline_entries, ntids FROM roaring_index_stats('rbi_ins_t');
 entries | inline_entries | ntids  
---------+----------------+--------
       9 |              2 | 100010
(1 row)

SELECT container_pages > 0 AS has_container_pages,
	   containers > entries AS several_containers_per_key
  FROM roaring_index_stats('rbi_ins_k');
 has_container_pages | several_containers_per_key 
---------------------+----------------------------
 t                   | t
(1 row)

-- Phase 4: UPDATE of an indexed column.  The new tuple cannot be HOT, so it
-- gets a fresh TID in every index; the old TIDs stay until VACUUM.
UPDATE rbi_ins SET k = 5 WHERE i BETWEEN 100 AND 5000;
SELECT rbi_ins_check('update indexed column');
                                                   rbi_ins_check                                                   
-------------------------------------------------------------------------------------------------------------------
 update indexed column | k=3 ok 7319 rows | t=v3 ok 14289 rows | t=v7 ok 3 rows | b ok 33338 rows | k=-1 ok 0 rows
(1 row)

SELECT rbi_cmp('rbi_ins', 'k = 5');
    rbi_cmp    
---------------
 ok 12216 rows
(1 row)

-- An update of a non-indexed column is HOT and leaves the index alone.
UPDATE rbi_ins SET i = i WHERE i BETWEEN 200 AND 300;
SELECT rbi_ins_check('hot update');
                                             rbi_ins_check                                              
--------------------------------------------------------------------------------------------------------
 hot update | k=3 ok 7319 rows | t=v3 ok 14289 rows | t=v7 ok 3 rows | b ok 33338 rows | k=-1 ok 0 rows
(1 row)

-- Phase 5: DELETE without VACUUM.  The index still points at the dead rows;
-- the bitmap heap scan has to filter them.
DELETE FROM rbi_ins WHERE i % 7 = 0;
SELECT rbi_ins_check('delete without vacuum');
                                                   rbi_ins_check                                                   
-------------------------------------------------------------------------------------------------------------------
 delete without vacuum | k=3 ok 6274 rows | t=v3 ok 14289 rows | t=v7 ok 2 rows | b ok 28575 rows | k=-1 ok 0 rows
(1 row)

-- Phase 6: a key that appears for the first time long after the build.
INSERT INTO rbi_ins VALUES (200001, 424242, 'brand new key', true);
SELECT rbi_ins_check('brand new key');
                                               rbi_ins_check                                               
-----------------------------------------------------------------------------------------------------------
 brand new key | k=3 ok 6274 rows | t=v3 ok 14289 rows | t=v7 ok 2 rows | b ok 28576 rows | k=-1 ok 0 rows
(1 row)

SELECT rbi_cmp('rbi_ins', 'k = 424242');
  rbi_cmp  
-----------
 ok 1 rows
(1 row)

SELECT rbi_cmp('rbi_ins', 't = ''brand new key''');
  rbi_cmp  
-----------
 ok 1 rows
(1 row)

-- Phase 7: cross-type insert values and cross-type scan keys.
INSERT INTO rbi_ins VALUES (200002, 3::int8, 'v7', true);
INSERT INTO rbi_ins VALUES (200003, 3::int2, 'v7'::varchar, false);
INSERT INTO rbi_ins VALUES (200004, 3::numeric, 'v7', true);
SELECT rbi_ins_check('cross-type values');
                                                 rbi_ins_check                                                 
---------------------------------------------------------------------------------------------------------------
 cross-type values | k=3 ok 6277 rows | t=v3 ok 14289 rows | t=v7 ok 5 rows | b ok 28578 rows | k=-1 ok 0 rows
(1 row)

SELECT rbi_cmp('rbi_ins', 'k = 3::int8');
   rbi_cmp    
--------------
 ok 6277 rows
(1 row)

SELECT rbi_cmp('rbi_ins', 'k = 3::int2');
   rbi_cmp    
--------------
 ok 6277 rows
(1 row)

-- NULL keys are not indexed, and must not upset the entry that has the same
-- hash bucket.
INSERT INTO rbi_ins VALUES (200005, NULL, NULL, NULL);
SELECT rbi_ins_check('null keys');
                                             rbi_ins_check                                             
-------------------------------------------------------------------------------------------------------
 null keys | k=3 ok 6277 rows | t=v3 ok 14289 rows | t=v7 ok 5 rows | b ok 28578 rows | k=-1 ok 0 rows
(1 row)

SELECT count(*) FROM rbi_ins WHERE k IS NULL;
 count 
-------
     1
(1 row)

/*
 * An INLINE entry that spills.  inline_limit = 64 bytes holds four one-pair
 * sparse segments, so the first inserts of a key stay inside the entry tuple
 * and a later one moves the posting set onto container pages.
 *
 * buckets = 1 on purpose: the 97 keys inserted below then all land in the
 * same bucket, which is the only way aminsert reaches the long entry list
 * and the bucket page chain (auto-sizing gives an index built on an empty
 * table RBI_DEFAULT_BUCKETS buckets, so nothing else here would).
 */
CREATE TABLE rbi_spill (i int4, k int4);
CREATE INDEX rbi_spill_k ON rbi_spill USING roaring (k)
	WITH (buckets = 1, inline_limit = 64);
INSERT INTO rbi_spill VALUES (1, 1);
-- the first TID of a key is one pair in one sparse segment (DESIGN.md 13)
SELECT entries, inline_entries, containers, sparse_segments, sparse_members,
	   ntids
  FROM roaring_index_stats('rbi_spill_k');
 entries | inline_entries | containers | sparse_segments | sparse_members | ntids 
---------+----------------+------------+-----------------+----------------+-------
       1 |              1 |          0 |               1 |              1 |     1
(1 row)

INSERT INTO rbi_spill SELECT i, 1 FROM generate_series(2, 200) i;
/*
 * These 200 rows are consecutive, so they share one container key: the
 * segment reaches RBI_SPARSE_THRESHOLD members, the key is promoted to a
 * container of its own, and that container is a single run of 14 bytes --
 * which still fits inline.
 */
SELECT entries, inline_entries, containers, sparse_segments, run_containers,
	   container_pages > 0 AS spilled, ntids
  FROM roaring_index_stats('rbi_spill_k');
 entries | inline_entries | containers | sparse_segments | run_containers | spilled | ntids 
---------+----------------+------------+-----------------+----------------+---------+-------
       1 |              1 |          1 |               0 |              1 | f       |   200
(1 row)

SELECT roaring_index_verify('rbi_spill_k', true);
 roaring_index_verify 
----------------------
 
(1 row)

-- Appends at the tail of the chain, then many more keys.
INSERT INTO rbi_spill SELECT i, i % 97 FROM generate_series(201, 60000) i;
SELECT entries, inline_entries, container_pages > 0 AS has_container_pages, ntids
  FROM roaring_index_stats('rbi_spill_k');
 entries | inline_entries | has_container_pages | ntids 
---------+----------------+---------------------+-------
      97 |              0 | t                   | 60000
(1 row)

SELECT roaring_index_verify('rbi_spill_k', true);
 roaring_index_verify 
----------------------
 
(1 row)

SELECT rbi_cmp('rbi_spill', 'k = 1');
   rbi_cmp   
-------------
 ok 816 rows
(1 row)

SELECT rbi_cmp('rbi_spill', 'k = 42');
   rbi_cmp   
-------------
 ok 617 rows
(1 row)

/*
 * ARRAY to BITSET growth: 40000 rows of two alternating keys cover about 178
 * heap blocks, so each key gets three container keys, the first with far
 * more than the 2048 members an array container can hold.  The keys have to
 * alternate: a key whose TIDs are consecutive ends up as a run container of
 * a handful of bytes and never reaches the array bound at all.
 */
CREATE TABLE rbi_dense (i int4, k int4);
CREATE INDEX rbi_dense_k ON rbi_dense USING roaring (k);
INSERT INTO rbi_dense SELECT i, i % 2 FROM generate_series(1, 40000) i;
SELECT bitset_containers > 0 AS has_bitset, sparse_segments, ntids
  FROM roaring_index_stats('rbi_dense_k');
 has_bitset | sparse_segments | ntids 
------------+-----------------+-------
 t          |               0 | 40000
(1 row)

SELECT roaring_index_verify('rbi_dense_k', true);
 roaring_index_verify 
----------------------
 
(1 row)

SELECT rbi_cmp('rbi_dense', 'k = 1');
    rbi_cmp    
---------------
 ok 20000 rows
(1 row)

/*
 * Inserts that land in the MIDDLE of a container chain, which is what makes
 * a container page split.
 *
 * Key 2 is spread over the whole heap and every one of its containers is a
 * bitset, so its chain is one container per page with no room to spare.  Key
 * 1 owns the low heap blocks alone; deleting it and vacuuming frees those
 * blocks without touching key 2's chain.  The rows inserted afterwards go
 * into the freed low blocks and belong before everything key 2 already has,
 * so their containers have to be placed at the head of a full chain -- and
 * they grow to bitsets there, because key 3 is interleaved with them and
 * keeps their members from forming runs.
 */
CREATE TABLE rbi_mid (i int4, k int4);
CREATE INDEX rbi_mid_k ON rbi_mid USING roaring (k) WITH (inline_limit = 64);
INSERT INTO rbi_mid
SELECT i, CASE WHEN i <= 100000 THEN 1 ELSE 2 - (i % 2) END
  FROM generate_series(1, 300000) i;
CREATE TEMP TABLE rbi_mid_before AS
	SELECT container_pages FROM roaring_index_stats('rbi_mid_k');
SELECT bitset_containers > 0 AS key2_has_bitsets
  FROM roaring_index_stats('rbi_mid_k');
 key2_has_bitsets 
------------------
 t
(1 row)

DELETE FROM rbi_mid WHERE k = 1;
VACUUM rbi_mid;
INSERT INTO rbi_mid SELECT i, 2 + (i % 2) FROM generate_series(300001, 400000) i;
-- the new containers do not fit where they belong, so pages were split
SELECT (SELECT container_pages FROM roaring_index_stats('rbi_mid_k')) >
	   (SELECT container_pages FROM rbi_mid_before) AS pages_split;
 pages_split 
-------------
 t
(1 row)

SELECT roaring_index_verify('rbi_mid_k', true);
 roaring_index_verify 
----------------------
 
(1 row)

SELECT rbi_cmp('rbi_mid', 'k = 2');
    rbi_cmp     
----------------
 ok 150000 rows
(1 row)

SELECT rbi_cmp('rbi_mid', 'k = 3');
    rbi_cmp    
---------------
 ok 50000 rows
(1 row)

SELECT ntids FROM roaring_index_stats('rbi_mid_k');
 ntids  
--------
 200000
(1 row)

/*
 * A new container key in the middle of an INLINE payload: key 1 has its TIDs
 * spread over the whole heap, so its inline payload is a list of containers
 * with rising container keys; after the low heap pages are freed and reused,
 * a new insert belongs in front of the ones that are left.
 */
CREATE TABLE rbi_inlmid (i int4, k int4);
CREATE INDEX rbi_inlmid_k ON rbi_inlmid USING roaring (k);
INSERT INTO rbi_inlmid
SELECT i, CASE WHEN i % 20000 = 0 THEN 1 ELSE 2 END
  FROM generate_series(1, 300000) i;
SELECT entries, inline_entries FROM roaring_index_stats('rbi_inlmid_k');
 entries | inline_entries 
---------+----------------
       2 |              1
(1 row)

DELETE FROM rbi_inlmid WHERE i <= 100000;
VACUUM rbi_inlmid;
INSERT INTO rbi_inlmid VALUES (300001, 1);
SELECT inline_entries, ntids FROM roaring_index_stats('rbi_inlmid_k');
 inline_entries | ntids  
----------------+--------
              1 | 200001
(1 row)

SELECT roaring_index_verify('rbi_inlmid_k', true);
 roaring_index_verify 
----------------------
 
(1 row)

SELECT rbi_cmp('rbi_inlmid', 'k = 1');
  rbi_cmp   
------------
 ok 11 rows
(1 row)

-- Inserts inside an aborted transaction leave the index consistent (the TIDs
-- stay behind, exactly as in every other index AM, and VACUUM removes them).
BEGIN;
INSERT INTO rbi_dense SELECT i, 2 FROM generate_series(20001, 25000) i;
ROLLBACK;
SELECT roaring_index_verify('rbi_dense_k', true);
 roaring_index_verify 
----------------------
 
(1 row)

SELECT rbi_cmp('rbi_dense', 'k = 2');
  rbi_cmp  
-----------
 ok 0 rows
(1 row)

VACUUM rbi_dense;
SELECT roaring_index_verify('rbi_dense_k', true);
 roaring_index_verify 
----------------------
 
(1 row)

SELECT rbi_cmp('rbi_dense', 'k = 2');
  rbi_cmp  
-----------
 ok 0 rows
(1 row)

/*
 * GROWTH SLACK (DESIGN.md section 4).  An item an insert writes on a
 * container page is allotted a few bytes more than it needs, and the next
 * members go into that slack in place, without moving anything else on the
 * page.  20 keys over 20000 rows put about 700 members in each container key
 * of each key: too many to stay a sparse segment, too few for a bitset, and
 * not consecutive, so every container is an ARRAY that grows two bytes at a
 * time.  inline_limit = 64 keeps the posting sets off the bucket pages, where
 * items have no slack.
 */
CREATE TABLE rbi_slack (i int4, k int4);
CREATE INDEX rbi_slack_k ON rbi_slack USING roaring (k) WITH (inline_limit = 64);
INSERT INTO rbi_slack SELECT i, i % 20 FROM generate_series(1, 20000) i;
SELECT array_containers > 0 AS has_arrays, slack_bytes > 0 AS has_slack,
	   slack_bytes <= 72 * (containers + sparse_segments) AS slack_within_bound
  FROM roaring_index_stats('rbi_slack_k');
 has_arrays | has_slack | slack_within_bound 
------------+-----------+--------------------
 t          | t         | t
(1 row)

SELECT roaring_index_verify('rbi_slack_k', true);
 roaring_index_verify 
----------------------
 
(1 row)

SELECT rbi_cmp('rbi_slack', 'k = 7');
   rbi_cmp    
--------------
 ok 1000 rows
(1 row)

-- More inserts into the same container keys: they go into the slack, and the
-- posting sets stay exactly as correct.
CREATE TEMP TABLE rbi_slack_before AS
	SELECT container_bytes, container_pages FROM roaring_index_stats('rbi_slack_k');
INSERT INTO rbi_slack SELECT i, i % 20 FROM generate_series(20001, 22000) i;
SELECT ntids, slack_bytes > 0 AS has_slack,
	   slack_bytes <= 72 * (containers + sparse_segments) AS slack_within_bound
  FROM roaring_index_stats('rbi_slack_k');
 ntids | has_slack | slack_within_bound 
-------+-----------+--------------------
 22000 | t         | t
(1 row)

SELECT (SELECT container_bytes FROM roaring_index_stats('rbi_slack_k')) >
	   (SELECT container_bytes FROM rbi_slack_before) AS items_grew;
 items_grew 
------------
 t
(1 row)

SELECT roaring_index_verify('rbi_slack_k', true);
 roaring_index_verify 
----------------------
 
(1 row)

SELECT rbi_cmp('rbi_slack', 'k = 7');
   rbi_cmp    
--------------
 ok 1100 rows
(1 row)

SELECT rbi_cmp('rbi_slack', 'k = 0');
   rbi_cmp    
--------------
 ok 1100 rows
(1 row)

-- A bulk build writes items at their exact size: a bulk-built index of the
-- very same rows has no slack at all.
CREATE INDEX rbi_slack_b ON rbi_slack USING roaring (k) WITH (inline_limit = 64);
SELECT array_containers > 0 AS has_arrays, slack_bytes AS bulk_slack_bytes
  FROM roaring_index_stats('rbi_slack_b');
 has_arrays | bulk_slack_bytes 
------------+------------------
 t          |                0
(1 row)

SELECT roaring_index_verify('rbi_slack_b', true);
 roaring_index_verify 
----------------------
 
(1 row)

/*
 * An index created empty and grown keeps the bucket count it was built with
 * (DESIGN.md section 5): 80000 distinct keys in 64 buckets make bucket chains
 * of several pages, which is what every lookup of a key has to walk.  The
 * insert path says so once per backend per index, and REINDEX sizes the
 * directory from the data that is there now.
 */
CREATE TABLE rbi_grow (i int4, k int4);
CREATE INDEX rbi_grow_k ON rbi_grow USING roaring (k);
SELECT nbuckets, max_bucket_pages FROM roaring_index_stats('rbi_grow_k');
 nbuckets | max_bucket_pages 
----------+------------------
       64 |                1
(1 row)

INSERT INTO rbi_grow SELECT i, i FROM generate_series(1, 80000) i;
WARNING:  roaring index "rbi_grow_k" has outgrown its bucket directory
SELECT nbuckets, max_bucket_pages > 4 AS outgrown
  FROM roaring_index_stats('rbi_grow_k');
 nbuckets | outgrown 
----------+----------
       64 | t
(1 row)

SELECT roaring_index_verify('rbi_grow_k', true);
 roaring_index_verify 
----------------------
 
(1 row)

SELECT rbi_cmp('rbi_grow', 'k = 12345');
  rbi_cmp  
-----------
 ok 1 rows
(1 row)

CREATE TEMP TABLE rbi_grow_before AS
	SELECT nbuckets, max_bucket_pages FROM roaring_index_stats('rbi_grow_k');
REINDEX INDEX rbi_grow_k;
SELECT (SELECT nbuckets FROM roaring_index_stats('rbi_grow_k')) >
	   (SELECT nbuckets FROM rbi_grow_before) AS directory_grew,
	   (SELECT max_bucket_pages FROM roaring_index_stats('rbi_grow_k')) <
	   (SELECT max_bucket_pages FROM rbi_grow_before) AS chains_shortened;
 directory_grew | chains_shortened 
----------------+------------------
 t              | t
(1 row)

SELECT roaring_index_verify('rbi_grow_k', true);
 roaring_index_verify 
----------------------
 
(1 row)

SELECT rbi_cmp('rbi_grow', 'k = 12345');
  rbi_cmp  
-----------
 ok 1 rows
(1 row)

-- An explicit bucket count is never warned about: it is what its owner asked
-- for (rbi_spill_k above has buckets = 1 and 97 keys and says nothing).
CREATE INDEX rbi_grow_x ON rbi_grow USING roaring (k) WITH (buckets = 4);
INSERT INTO rbi_grow VALUES (80001, 80001);
SELECT nbuckets, max_bucket_pages > 4 AS outgrown
  FROM roaring_index_stats('rbi_grow_x');
 nbuckets | outgrown 
----------+----------
        4 | t
(1 row)

DROP INDEX rbi_grow_x;
/*
 * ambuild sizes the directory for the heap it is told about: when
 * pg_class.reltuples says the table holds more rows than the build put in the
 * index, the estimate is scaled up by that ratio (DESIGN.md section 5), and a
 * partial index is sized for the rows its predicate selects instead.
 */
CREATE TABLE rbi_relt (i int4, k int4);
INSERT INTO rbi_relt SELECT i, i FROM generate_series(1, 40000) i;
ANALYZE rbi_relt;
DELETE FROM rbi_relt WHERE i > 4000;
CREATE INDEX rbi_relt_k ON rbi_relt USING roaring (k);
CREATE INDEX rbi_relt_p ON rbi_relt USING roaring (k) WHERE i <= 2000;
SELECT (SELECT nbuckets FROM roaring_index_stats('rbi_relt_k')) >
	   (SELECT nbuckets FROM roaring_index_stats('rbi_relt_p'))
	   AS whole_table_sized_larger;
 whole_table_sized_larger 
--------------------------
 t
(1 row)

CREATE TEMP TABLE rbi_relt_before AS
	SELECT nbuckets FROM roaring_index_stats('rbi_relt_k');
-- once the statistics tell the truth, the same data wants a smaller directory
VACUUM (ANALYZE) rbi_relt;
REINDEX INDEX rbi_relt_k;
SELECT (SELECT nbuckets FROM roaring_index_stats('rbi_relt_k')) <
	   (SELECT nbuckets FROM rbi_relt_before) AS directory_shrank;
 directory_shrank 
------------------
 t
(1 row)

SELECT roaring_index_verify('rbi_relt_k', true);
 roaring_index_verify 
----------------------
 
(1 row)

SELECT roaring_index_verify('rbi_relt_p', true);
 roaring_index_verify 
----------------------
 
(1 row)

SELECT rbi_cmp('rbi_relt', 'k = 1234');
  rbi_cmp  
-----------
 ok 1 rows
(1 row)

DROP TABLE rbi_ins, rbi_spill, rbi_dense, rbi_mid, rbi_inlmid, rbi_slack,
		   rbi_grow, rbi_relt;
DROP FUNCTION rbi_ins_check(text);
