-- roaring_index_stats() and roaring_index_verify() (DESIGN.md section 7).
\set VERBOSITY terse
SET client_min_messages = warning;
CREATE EXTENSION IF NOT EXISTS roaring_index;
SELECT setseed(0.42);
 setseed 
---------
 
(1 row)

-- What the functions look like.
\df roaring_index_stats
                                                                                                                                                                                                                                   List of functions
 Schema |        Name         | Result data type |                                                                                                                                                                                                     Argument data types                                                                                                                                                                                                      | Type 
--------+---------------------+------------------+------------------------------------------------------------------------------------------------------------------------------------------------------------------------------------------------------------------------------------------------------------------------------------------------------------------------------------------------------------------------------------------------------------------------------+------
 public | roaring_index_stats | record           | idx regclass, OUT nbuckets integer, OUT bucket_pages bigint, OUT entries bigint, OUT inline_entries bigint, OUT container_pages bigint, OUT containers bigint, OUT array_containers bigint, OUT bitset_containers bigint, OUT run_containers bigint, OUT ntids bigint, OUT container_bytes bigint, OUT free_bytes bigint, OUT sparse_segments bigint, OUT sparse_members bigint, OUT null_tids bigint, OUT empty_tids bigint | func
(1 row)

\df roaring_index_verify
                                              List of functions
 Schema |         Name         | Result data type |                Argument data types                 | Type 
--------+----------------------+------------------+----------------------------------------------------+------
 public | roaring_index_verify | void             | idx regclass, heapallindexed boolean DEFAULT false | func
(1 row)

/*
 * Every shape the index can be in: an empty index, one built by ambuild,
 * one filled by aminsert, one that has been vacuumed, and one of each entry
 * kind (INLINE and CHAIN).
 */
CREATE TABLE rbi_vfy_empty (k int4);
CREATE INDEX rbi_vfy_empty_k ON rbi_vfy_empty USING roaring (k)
	WITH (buckets = 4);
SELECT * FROM roaring_index_stats('rbi_vfy_empty_k');
 nbuckets | bucket_pages | entries | inline_entries | container_pages | containers | array_containers | bitset_containers | run_containers | ntids | container_bytes | free_bytes | sparse_segments | sparse_members | null_tids | empty_tids 
----------+--------------+---------+----------------+-----------------+------------+------------------+-------------------+----------------+-------+-----------------+------------+-----------------+----------------+-----------+------------
        4 |            4 |       0 |              0 |               0 |          0 |                0 |                 0 |              0 |     0 |               0 |      32592 |               0 |              0 |         0 |          0
(1 row)

SELECT roaring_index_verify('rbi_vfy_empty_k');
 roaring_index_verify 
----------------------
 
(1 row)

SELECT roaring_index_verify('rbi_vfy_empty_k', true);
 roaring_index_verify 
----------------------
 
(1 row)

CREATE TABLE rbi_vfy (i int4, k int4, t text, n numeric, u uuid);
INSERT INTO rbi_vfy
SELECT i, i % 997, 'v' || (i % 13), (i % 71)::numeric / 4,
	   md5((i % 29)::text)::uuid
  FROM generate_series(1, 100000) i;
-- built by ambuild
CREATE INDEX rbi_vfy_k ON rbi_vfy USING roaring (k) WITH (buckets = 32);
CREATE INDEX rbi_vfy_t ON rbi_vfy USING roaring (t);
CREATE INDEX rbi_vfy_n ON rbi_vfy USING roaring (n) WITH (inline_limit = 64);
CREATE INDEX rbi_vfy_u ON rbi_vfy USING roaring (u);
SELECT nbuckets, entries, inline_entries, containers, ntids
  FROM roaring_index_stats('rbi_vfy_k');
 nbuckets | entries | inline_entries | containers | ntids  
----------+---------+----------------+------------+--------
       32 |     997 |            997 |      12961 | 100000
(1 row)

SELECT nbuckets, entries, inline_entries, containers, ntids
  FROM roaring_index_stats('rbi_vfy_t');
 nbuckets | entries | inline_entries | containers | ntids  
----------+---------+----------------+------------+--------
       64 |      13 |              0 |        169 | 100000
(1 row)

SELECT entries, inline_entries, ntids FROM roaring_index_stats('rbi_vfy_n');
 entries | inline_entries | ntids  
---------+----------------+--------
      71 |              0 | 100000
(1 row)

SELECT entries, inline_entries, ntids FROM roaring_index_stats('rbi_vfy_u');
 entries | inline_entries | ntids  
---------+----------------+--------
      29 |              0 | 100000
(1 row)

SELECT roaring_index_verify('rbi_vfy_k', true);
 roaring_index_verify 
----------------------
 
(1 row)

SELECT roaring_index_verify('rbi_vfy_t', true);
 roaring_index_verify 
----------------------
 
(1 row)

SELECT roaring_index_verify('rbi_vfy_n', true);
 roaring_index_verify 
----------------------
 
(1 row)

SELECT roaring_index_verify('rbi_vfy_u', true);
 roaring_index_verify 
----------------------
 
(1 row)

-- container bytes and free bytes are consistent with the pages they live on
SELECT container_bytes > 0 AS has_bytes,
	   container_bytes + free_bytes <
	   (bucket_pages + container_pages) * current_setting('block_size')::int8
	   AS fits_in_its_pages
  FROM roaring_index_stats('rbi_vfy_t');
 has_bytes | fits_in_its_pages 
-----------+-------------------
 t         | t
(1 row)

-- filled by aminsert on top of the built index
INSERT INTO rbi_vfy
SELECT i, i % 997, 'v' || (i % 13), (i % 71)::numeric / 4,
	   md5((i % 29)::text)::uuid
  FROM generate_series(100001, 150000) i;
SELECT entries, ntids FROM roaring_index_stats('rbi_vfy_k');
 entries | ntids  
---------+--------
     997 | 150000
(1 row)

SELECT roaring_index_verify('rbi_vfy_k', true);
 roaring_index_verify 
----------------------
 
(1 row)

SELECT roaring_index_verify('rbi_vfy_t', true);
 roaring_index_verify 
----------------------
 
(1 row)

SELECT roaring_index_verify('rbi_vfy_n', true);
 roaring_index_verify 
----------------------
 
(1 row)

-- a non-HOT update: the indexed column changes, so a new TID is indexed
UPDATE rbi_vfy SET k = 998 WHERE i % 1000 = 0;
SELECT roaring_index_verify('rbi_vfy_k', true);
 roaring_index_verify 
----------------------
 
(1 row)

SELECT entries FROM roaring_index_stats('rbi_vfy_k');
 entries 
---------
     998
(1 row)

/*
 * heapallindexed with HOT updates: the updated column is not indexed and the
 * table has room on its pages, so the new tuples are heap-only and the index
 * still points at the root of each HOT chain.  The heap scan has to follow
 * that mapping, or every updated row would look unindexed.
 */
CREATE TABLE rbi_vfy_hot (i int4, k int4, payload text) WITH (fillfactor = 50);
INSERT INTO rbi_vfy_hot
SELECT i, i % 97, 'p' || i FROM generate_series(1, 50000) i;
CREATE INDEX rbi_vfy_hot_k ON rbi_vfy_hot USING roaring (k);
UPDATE rbi_vfy_hot SET payload = 'q' || i WHERE i % 3 = 0;
SELECT pg_stat_get_xact_tuples_hot_updated('rbi_vfy_hot'::regclass) > 0
	   AS had_hot_updates;
 had_hot_updates 
-----------------
 t
(1 row)

SELECT roaring_index_verify('rbi_vfy_hot_k', true);
 roaring_index_verify 
----------------------
 
(1 row)

SELECT entries, ntids FROM roaring_index_stats('rbi_vfy_hot_k');
 entries | ntids 
---------+-------
      97 | 50000
(1 row)

-- the HOT chains survive a VACUUM (which prunes them) unchanged
VACUUM rbi_vfy_hot;
SELECT roaring_index_verify('rbi_vfy_hot_k', true);
 roaring_index_verify 
----------------------
 
(1 row)

SELECT entries, ntids FROM roaring_index_stats('rbi_vfy_hot_k');
 entries | ntids 
---------+-------
      97 | 50000
(1 row)

/*
 * Deletes that the verification has to ignore: the rows are gone from the
 * heap scan's snapshot but their TIDs are still in the index, which is not
 * an error (only missing index entries are).
 */
BEGIN;
DELETE FROM rbi_vfy WHERE i % 5 = 0;
SELECT roaring_index_verify('rbi_vfy_k', true);
 roaring_index_verify 
----------------------
 
(1 row)

SELECT roaring_index_verify('rbi_vfy_t', true);
 roaring_index_verify 
----------------------
 
(1 row)

ROLLBACK;
-- ... and after the delete is rolled back, every row must be found again
SELECT roaring_index_verify('rbi_vfy_k', true);
 roaring_index_verify 
----------------------
 
(1 row)

-- committed deletes, before and after VACUUM removes the TIDs
DELETE FROM rbi_vfy WHERE i % 5 = 0;
SELECT roaring_index_verify('rbi_vfy_k', true);
 roaring_index_verify 
----------------------
 
(1 row)

SELECT roaring_index_verify('rbi_vfy_u', true);
 roaring_index_verify 
----------------------
 
(1 row)

VACUUM rbi_vfy;
SELECT roaring_index_verify('rbi_vfy_k', true);
 roaring_index_verify 
----------------------
 
(1 row)

SELECT roaring_index_verify('rbi_vfy_u', true);
 roaring_index_verify 
----------------------
 
(1 row)

SELECT entries, ntids FROM roaring_index_stats('rbi_vfy_k');
 entries | ntids  
---------+--------
     998 | 120000
(1 row)

/*
 * Sparse segments (DESIGN.md section 13).  i is unique, so every one of its
 * container keys has a single member and the whole index is segments; the
 * verification checks their internal order, that their ranges do not overlap
 * their neighbours', and that no container key inside one has reached the
 * threshold that gives it a container.
 */
CREATE INDEX rbi_vfy_i ON rbi_vfy USING roaring (i);
SELECT containers, sparse_segments > 0 AS has_segments,
	   sparse_members = ntids AS every_tid_in_a_segment
  FROM roaring_index_stats('rbi_vfy_i');
 containers | has_segments | every_tid_in_a_segment 
------------+--------------+------------------------
          0 | t            | t
(1 row)

SELECT roaring_index_verify('rbi_vfy_i', true);
 roaring_index_verify 
----------------------
 
(1 row)

DELETE FROM rbi_vfy WHERE i % 7 = 0;
VACUUM rbi_vfy;
SELECT roaring_index_verify('rbi_vfy_i', true);
 roaring_index_verify 
----------------------
 
(1 row)

SELECT sparse_members = ntids AS still_all_segments,
	   ntids = (SELECT count(*) FROM rbi_vfy WHERE i IS NOT NULL) AS ntids_matches_heap
  FROM roaring_index_stats('rbi_vfy_i');
 still_all_segments | ntids_matches_heap 
--------------------+--------------------
 t                  | t
(1 row)

-- a partial index only has to contain the rows its predicate selects
CREATE INDEX rbi_vfy_part ON rbi_vfy USING roaring (t) WHERE k < 100;
SELECT roaring_index_verify('rbi_vfy_part', true);
 roaring_index_verify 
----------------------
 
(1 row)

SELECT entries, ntids FROM roaring_index_stats('rbi_vfy_part');
 entries | ntids 
---------+-------
      13 | 10355
(1 row)

INSERT INTO rbi_vfy VALUES (200001, 5, 'vpart', 1.0, NULL, NULL);
ERROR:  INSERT has more expressions than target columns at character 60
INSERT INTO rbi_vfy VALUES (200002, 500, 'vpart', 1.0, NULL, NULL);
ERROR:  INSERT has more expressions than target columns at character 62
SELECT roaring_index_verify('rbi_vfy_part', true);
 roaring_index_verify 
----------------------
 
(1 row)

SELECT ntids FROM roaring_index_stats('rbi_vfy_part');
 ntids 
-------
 10355
(1 row)

-- an expression index is verified through the same path
CREATE INDEX rbi_vfy_expr ON rbi_vfy USING roaring ((k % 10));
SELECT roaring_index_verify('rbi_vfy_expr', true);
 roaring_index_verify 
----------------------
 
(1 row)

SELECT entries FROM roaring_index_stats('rbi_vfy_expr');
 entries 
---------
      10
(1 row)

-- NULL keys are not indexed and must not be reported as missing
INSERT INTO rbi_vfy VALUES (200003, NULL, NULL, NULL, NULL, NULL);
ERROR:  INSERT has more expressions than target columns at character 61
SELECT roaring_index_verify('rbi_vfy_k', true);
 roaring_index_verify 
----------------------
 
(1 row)

SELECT roaring_index_verify('rbi_vfy_t', true);
 roaring_index_verify 
----------------------
 
(1 row)

-- unlogged relations work the same way
CREATE UNLOGGED TABLE rbi_vfy_unl (i int4, k int4);
CREATE INDEX rbi_vfy_unl_k ON rbi_vfy_unl USING roaring (k);
INSERT INTO rbi_vfy_unl SELECT i, i % 37 FROM generate_series(1, 20000) i;
SELECT roaring_index_verify('rbi_vfy_unl_k', true);
 roaring_index_verify 
----------------------
 
(1 row)

SELECT entries, ntids FROM roaring_index_stats('rbi_vfy_unl_k');
 entries | ntids 
---------+-------
      37 | 20000
(1 row)

-- Things that are not roaring indexes.
CREATE INDEX rbi_vfy_bt ON rbi_vfy_unl (k);
SELECT roaring_index_verify('rbi_vfy_bt');
ERROR:  "rbi_vfy_bt" is not a roaring index
SELECT roaring_index_stats('rbi_vfy_bt');
ERROR:  "rbi_vfy_bt" is not a roaring index
SELECT roaring_index_verify('rbi_vfy_unl');
ERROR:  "rbi_vfy_unl" is not an index
SELECT roaring_index_stats('rbi_vfy_unl');
ERROR:  "rbi_vfy_unl" is not an index
SELECT roaring_index_verify('no_such_relation');
ERROR:  relation "no_such_relation" does not exist at character 29
DROP TABLE rbi_vfy, rbi_vfy_empty, rbi_vfy_unl, rbi_vfy_hot;
